,trade Id,Time,Stock symbol,Company,Price,Quantity,Total Amount ($),Stock/Option,Strike Price,Option type,Action,Option Expire Date,ticker,long/short,Date
0,4.038638632645796e+17,01/15/2021 13:17:05 EST,TDOC,TELADOC HEALTH,4.40,1,440.00,OPTION,222.50,put,SELL,2021-01-22,913254759.0,long,2021-01-15
1,4.038450513246945e+17,01/15/2021 12:01:34 EST,PLTR,Palantir Technologies Inc.,0.92,1,92.00,OPTION,26.00,put,SELL,2021-01-22,950172475.0,long,2021-01-15
2,4.0384496422580634e+17,01/15/2021 12:01:13 EST,TDOC,TELADOC HEALTH,0.19,1,19.00,OPTION,220.00,put,BUY,2021-01-15,913254759.0,short,2021-01-15
3,4.0383731767407e+17,01/15/2021 11:30:50 EST,UVXY,ProShares Ultra VIX Short-Term Futures,10.69,200,2138.00,STOCK,,,SELL,,913424717.0,short,2021-01-15
4,4.0383483196585984e+17,01/15/2021 11:20:57 EST,PLTR,Palantir Technologies Inc.,0.25,1,25.00,OPTION,26.00,put,SELL,2021-01-15,950172475.0,long,2021-01-15
5,4.038342919744512e+17,01/15/2021 11:18:49 EST,JD,JD.com,0.11,1,11.00,OPTION,90.00,call,SELL,2021-01-15,913255864.0,short,2021-01-15
6,4.03825769203114e+17,01/15/2021 10:44:57 EST,STIC,NORTHERN STAR,15.05,100,1505.00,STOCK,,,BUY,,950179021.0,long,2021-01-15
7,4.0382520330346906e+17,01/15/2021 10:42:42 EST,OPEN,Opendoor Technologies Inc,25.73,200,5145.00,STOCK,,,SELL,,950169649.0,short,2021-01-15
8,4.038136383994634e+17,01/15/2021 09:56:45 EST,PLTR,Palantir Technologies Inc.,0.13,4,52.00,OPTION,29.50,call,SELL,2021-01-15,950172475.0,short,2021-01-15
9,4.0381328418206515e+17,01/15/2021 09:55:22 EST,PLTR,Palantir Technologies Inc.,0.79,4,316.00,OPTION,27.50,call,BUY,2021-01-15,950172475.0,long,2021-01-15
10,4.0354067217238016e+17,01/14/2021 15:52:04 EST,UVXY,ProShares Ultra VIX Short-Term Futures,0.54,2,108.00,OPTION,10.00,call,BUY,2021-01-15,913424717.0,long,2021-01-14
11,4.035243062414049e+17,01/14/2021 15:33:59 EST,OPEN,Opendoor Technologies Inc,0.50,1,50.00,OPTION,27.00,call,BUY,2021-01-15,950169649.0,long,2021-01-14
12,4.03491659351892e+17,01/14/2021 12:37:44 EST,NIO,NIO Inc.,1.71,1,171.00,OPTION,57.50,put,SELL,2021-01-22,950076017.0,long,2021-01-14
13,4.0349157487866266e+17,01/14/2021 12:36:59 EST,PLTR,Palantir Technologies Inc.,0.05,1,5.00,OPTION,23.50,put,BUY,2021-01-15,950172475.0,short,2021-01-14
14,4.034915385350185e+17,01/14/2021 12:36:50 EST,TTCF,"Tattooed Chef, Inc.",0.05,2,10.00,OPTION,22.50,put,BUY,2021-01-15,950102446.0,short,2021-01-14
15,4.034871433909289e+17,01/14/2021 12:19:22 EST,OPEN,Opendoor Technologies Inc,0.56,1,56.00,OPTION,27.00,call,SELL,2021-01-15,950169649.0,short,2021-01-14
16,4.034867062061097e+17,01/14/2021 12:18:05 EST,OPEN,Opendoor Technologies Inc,26.64,200,5328.00,STOCK,,,BUY,,950169649.0,long,2021-01-14
17,4.0348370805889434e+17,01/14/2021 12:05:43 EST,NVDA,Nvidia,534.43,10,5344.30,STOCK,,,SELL,,913257561.0,short,2021-01-14
18,4.0345153618262835e+17,01/14/2021 09:57:53 EST,UVXY,ProShares Ultra VIX Short-Term Futures,0.31,2,62.00,OPTION,10.00,call,SELL,2021-01-15,913424717.0,short,2021-01-14
19,4.032372994390917e+17,01/13/2021 19:46:35 EST,UVXY,ProShares Ultra VIX Short-Term Futures,10.22,200,2044.00,STOCK,,,BUY,,913424717.0,long,2021-01-13
20,4.032331364330619e+17,01/13/2021 19:30:03 EST,STIC,NORTHERN STAR,14.75,100,1475.00,STOCK,,,BUY,,950179021.0,long,2021-01-13
21,4.0317626678367846e+17,01/13/2021 15:44:51 EST,JD,JD.com,2.37,2,474.00,OPTION,94.00,call,BUY,2021-01-29,913255864.0,long,2021-01-13
22,4.031762069141791e+17,01/13/2021 15:43:50 EST,JD,JD.com,4.60,1,460.00,OPTION,92.00,put,SELL,2021-01-29,913255864.0,long,2021-01-13
23,4.031760871080673e+17,01/13/2021 15:43:20 EST,JD,JD.com,0.33,1,33.00,OPTION,87.00,put,BUY,2021-01-15,913255864.0,short,2021-01-13
24,4.031488447008932e+17,01/13/2021 13:55:28 EST,PLTR,Palantir Technologies Inc.,1.09,2,218.00,OPTION,26.00,call,SELL,2021-01-22,950172475.0,short,2021-01-13
25,4.0314829680727245e+17,01/13/2021 13:52:55 EST,PLTR,Palantir Technologies Inc.,1.05,2,210.00,OPTION,26.00,call,BUY,2021-01-22,950172475.0,long,2021-01-13
26,4.031127062294487e+17,01/13/2021 11:31:29 EST,NIO,NIO Inc.,0.14,1,14.00,OPTION,55.00,put,BUY,2021-01-15,950076017.0,short,2021-01-13
27,4.031091602894602e+17,01/13/2021 11:17:25 EST,PLTR,Palantir Technologies Inc.,0.27,4,108.00,OPTION,27.50,call,SELL,2021-01-15,950172475.0,short,2021-01-13
28,4.030963103932375e+17,01/13/2021 10:26:20 EST,TIGR,UP Fintech Holding,12.23,100,1223.00,STOCK,,,BUY,,925306034.0,long,2021-01-13
29,4.030945724707758e+17,01/13/2021 10:19:26 EST,TIGR,UP Fintech Holding,12.24,100,1224.00,STOCK,,,SHORT,,925306034.0,short,2021-01-13
30,4.0308386145570406e+17,01/13/2021 09:36:52 EST,NIO,NIO Inc.,2.04,1,204.00,OPTION,60.00,put,SELL,2021-01-22,950076017.0,long,2021-01-13
31,4.0281012537247334e+17,01/12/2021 15:29:08 EST,JD,JD.com,1.01,1,101.00,OPTION,87.00,put,SELL,2021-01-15,913255864.0,long,2021-01-12
32,4.028030807452426e+17,01/12/2021 15:01:09 EST,TDOC,TELADOC HEALTH,1.16,1,116.00,OPTION,220.00,put,SELL,2021-01-15,913254759.0,long,2021-01-12
33,4.027812586960036e+17,01/12/2021 13:34:48 EST,UVXY,ProShares Ultra VIX Short-Term Futures,10.86,100,1086.17,STOCK,,,SELL,,913424717.0,short,2021-01-12
34,4.027785503835013e+17,01/12/2021 13:23:48 EST,IIPR,Innovative Indl,182.72,10,1827.20,STOCK,,,SELL,,925174192.0,short,2021-01-12
35,4.027777839289549e+17,01/12/2021 13:20:38 EST,PLTR,Palantir Technologies Inc.,0.11,4,44.00,OPTION,29.00,call,BUY,2021-01-15,950172475.0,long,2021-01-12
36,4.027627345104159e+17,01/12/2021 12:21:20 EST,IIPR,Innovative Indl,181.66,5,908.30,STOCK,,,BUY,,925174192.0,long,2021-01-12
37,4.027597895763026e+17,01/12/2021 12:09:07 EST,TDOC,TELADOC HEALTH,0.43,1,43.00,OPTION,250.00,call,SELL,2021-01-15,913254759.0,short,2021-01-12
38,4.027592085099684e+17,01/12/2021 12:06:49 EST,PLTR,Palantir Technologies Inc.,0.10,4,40.00,OPTION,29.00,call,SELL,2021-01-15,950172475.0,short,2021-01-12
39,4.027561021833011e+17,01/12/2021 11:54:28 EST,BEKE,KE Holdings Inc.,0.31,1,31.00,OPTION,70.00,call,SELL,2021-01-15,950169866.0,short,2021-01-12
40,4.0275597564954214e+17,01/12/2021 11:53:58 EST,UBER,Uber,1.27,1,127.00,OPTION,58.00,call,SELL,2021-01-15,950121423.0,short,2021-01-12
41,4.027553240602419e+17,01/12/2021 11:51:39 EST,IIPR,Innovative Indl,182.98,5,914.90,STOCK,,,BUY,,925174192.0,long,2021-01-12
42,4.027541183404114e+17,01/12/2021 11:46:36 EST,IIPR,Innovative Indl,184.33,5,921.67,STOCK,,,BUY,,925174192.0,long,2021-01-12
43,4.027514809872425e+17,01/12/2021 11:36:07 EST,PLTR,Palantir Technologies Inc.,1.40,1,140.00,OPTION,26.00,call,SELL,2021-01-22,950172475.0,short,2021-01-12
44,4.02751425043628e+17,01/12/2021 11:35:53 EST,PLTR,Palantir Technologies Inc.,1.32,1,132.00,OPTION,26.00,put,BUY,2021-01-22,950172475.0,short,2021-01-12
45,4.0273779939823206e+17,01/12/2021 10:41:45 EST,RKT,Rocket Companies,0.82,10,820.00,OPTION,19.50,call,SELL,2021-01-22,950168855.0,short,2021-01-12
46,4.0273741644578e+17,01/12/2021 10:40:21 EST,PLTR,Palantir Technologies Inc.,1.37,1,137.00,OPTION,26.00,call,BUY,2021-01-22,950172475.0,long,2021-01-12
47,4.027373694653112e+17,01/12/2021 10:40:24 EST,PLTR,Palantir Technologies Inc.,1.37,1,137.00,OPTION,26.00,put,SELL,2021-01-22,950172475.0,long,2021-01-12
48,4.027322680466104e+17,01/12/2021 10:19:46 EST,TDOC,TELADOC HEALTH,2.96,1,296.00,OPTION,235.00,call,BUY,2021-01-15,913254759.0,long,2021-01-12
49,4.0271373981771366e+17,01/12/2021 09:30:00 EST,UVXY,ProShares Ultra VIX Short-Term Futures,10.75,100,1075.00,STOCK,,,BUY,,913424717.0,long,2021-01-12
50,4.0245221230484275e+17,01/11/2021 15:47:04 EST,NIO,NIO Inc.,0.86,1,86.00,OPTION,57.00,put,SELL,2021-01-15,950076017.0,long,2021-01-11
51,4.0245210049734656e+17,01/11/2021 15:46:28 EST,NIO,NIO Inc.,0.14,1,14.00,OPTION,50.00,put,BUY,2021-01-15,950076017.0,short,2021-01-11
52,4.0244767548563866e+17,01/11/2021 15:28:54 EST,TDOC,TELADOC HEALTH,1.27,1,127.00,OPTION,235.00,call,SELL,2021-01-15,913254759.0,short,2021-01-11
53,4.0237546769025024e+17,01/11/2021 10:41:58 EST,AMZN,Amazon.com,3142.64,1,3142.64,STOCK,,,BUY,,913256180.0,long,2021-01-11
54,4.023718097873879e+17,01/11/2021 10:27:26 EST,NIO,NIO Inc.,0.85,1,85.00,OPTION,57.00,put,SELL,2021-01-15,950076017.0,long,2021-01-11
55,4.0236940143477965e+17,01/11/2021 10:17:58 EST,UVXY,ProShares Ultra VIX Short-Term Futures,10.70,100,1070.00,STOCK,,,SELL,,913424717.0,short,2021-01-11
56,4.0236424865685094e+17,01/11/2021 09:57:22 EST,UVXY,ProShares Ultra VIX Short-Term Futures,10.61,100,1061.00,STOCK,,,SELL,,913424717.0,short,2021-01-11
57,4.013677247747236e+17,01/08/2021 15:57:34 EST,PLTR,Palantir Technologies Inc.,0.70,2,140.00,OPTION,26.00,call,SELL,2021-01-15,950172475.0,short,2021-01-08
58,4.013623903666176e+17,01/08/2021 15:36:41 EST,NIO,NIO Inc.,2.11,1,211.00,OPTION,55.00,put,SELL,2021-01-15,950076017.0,long,2021-01-08
59,4.013604071277691e+17,01/08/2021 15:28:29 EST,PLTR,Palantir Technologies Inc.,0.77,2,154.00,OPTION,26.00,call,BUY,2021-01-15,950172475.0,long,2021-01-08
60,4.013584111507702e+17,01/08/2021 15:20:33 EST,PLTR,Palantir Technologies Inc.,0.84,3,252.00,OPTION,26.00,call,SELL,2021-01-15,950172475.0,short,2021-01-08
61,4.013582663843553e+17,01/08/2021 15:20:23 EST,RKT,Rocket Companies,0.76,5,380.00,OPTION,20.00,call,SELL,2021-01-22,950168855.0,short,2021-01-08
62,4.013573988554506e+17,01/08/2021 15:16:31 EST,PLTR,Palantir Technologies Inc.,0.84,2,168.00,OPTION,26.00,call,SELL,2021-01-15,950172475.0,short,2021-01-08
63,4.0134405069685555e+17,01/08/2021 14:23:39 EST,PLTR,Palantir Technologies Inc.,0.72,5,360.00,OPTION,26.00,call,BUY,2021-01-15,950172475.0,long,2021-01-08
64,4.01330007923884e+17,01/08/2021 13:27:41 EST,UBER,Uber,0.44,1,44.00,OPTION,53.00,call,BUY,2021-01-08,950121423.0,long,2021-01-08
65,4.012971569604813e+17,01/08/2021 11:17:09 EST,JD,JD.com,2.26,3,678.00,OPTION,90.00,call,SELL,2021-01-15,913255864.0,short,2021-01-08
66,4.012921345582121e+17,01/08/2021 10:57:11 EST,PLTR,Palantir Technologies Inc.,0.11,3,33.00,OPTION,26.50,call,SELL,2021-01-08,950172475.0,short,2021-01-08
67,4.0128953110768435e+17,01/08/2021 10:46:51 EST,JD,JD.com,1.54,2,308.00,OPTION,90.00,call,SELL,2021-01-15,913255864.0,short,2021-01-08
68,4.0128558813476864e+17,01/08/2021 10:31:10 EST,TTCF,"Tattooed Chef, Inc.",0.75,2,150.00,OPTION,22.50,put,SELL,2021-01-15,950102446.0,long,2021-01-08
69,4.01284281810432e+17,01/08/2021 10:25:59 EST,TDOC,TELADOC HEALTH,0.23,1,23.00,OPTION,240.00,call,SELL,2021-01-08,913254759.0,short,2021-01-08
70,4.012835400519434e+17,01/08/2021 10:23:02 EST,JD,JD.com,1.38,5,690.00,OPTION,90.00,call,BUY,2021-01-15,913255864.0,long,2021-01-08
71,4.012815521489592e+17,01/08/2021 10:15:08 EST,UVXY,ProShares Ultra VIX Short-Term Futures,0.05,2,10.00,OPTION,11.00,call,SELL,2021-01-08,913424717.0,short,2021-01-08
72,4.012776219686666e+17,01/08/2021 09:59:36 EST,UVXY,ProShares Ultra VIX Short-Term Futures,10.19,50,509.50,STOCK,,,BUY,,913424717.0,long,2021-01-08
73,4.0127594367248384e+17,01/08/2021 09:52:51 EST,PLTR,Palantir Technologies Inc.,0.57,3,171.00,OPTION,25.50,call,SELL,2021-01-08,950172475.0,short,2021-01-08
74,4.012758369022198e+17,01/08/2021 09:52:26 EST,TDOC,TELADOC HEALTH,7.99,1,799.00,OPTION,235.00,call,BUY,2021-01-15,913254759.0,long,2021-01-08
75,4.012738743035044e+17,01/08/2021 09:44:38 EST,RUN,Sunrun,2.65,1,265.00,OPTION,90.00,put,SELL,2021-01-15,913256036.0,long,2021-01-08
76,4.0127293258153165e+17,01/08/2021 09:40:53 EST,RUN,Sunrun,90.83,100,9083.00,STOCK,,,SELL,,913256036.0,short,2021-01-08
77,4.012728932935393e+17,01/08/2021 09:40:44 EST,RUN,Sunrun,1.37,1,137.00,OPTION,100.00,call,BUY,2021-01-15,913256036.0,long,2021-01-08
78,4.012723816094556e+17,01/08/2021 09:38:57 EST,BEKE,KE Holdings Inc.,2.50,1,250.00,OPTION,65.00,call,BUY,2021-01-15,950169866.0,long,2021-01-08
79,4.012709755990794e+17,01/08/2021 09:38:09 EST,JD,JD.com,1.20,1,120.00,OPTION,90.00,call,BUY,2021-01-08,913255864.0,long,2021-01-08
80,4.012704700260106e+17,01/08/2021 09:31:07 EST,PLTR,Palantir Technologies Inc.,0.43,3,129.00,OPTION,25.50,call,BUY,2021-01-08,950172475.0,long,2021-01-08
81,4.012703984628777e+17,01/08/2021 09:30:50 EST,PLTR,Palantir Technologies Inc.,0.47,3,141.00,OPTION,25.50,call,BUY,2021-01-08,950172475.0,long,2021-01-08
82,4.0101539735832166e+17,01/07/2021 16:37:31 EST,UVXY,ProShares Ultra VIX Short-Term Futures,10.34,50,517.00,STOCK,,,BUY,,913424717.0,long,2021-01-07
83,4.0098769596431155e+17,01/07/2021 14:47:27 EST,RUN,Sunrun,3.60,1,360.00,OPTION,90.00,put,BUY,2021-01-15,913256036.0,short,2021-01-07
84,4.009830585992274e+17,01/07/2021 14:29:02 EST,JD,JD.com,0.37,1,37.00,OPTION,90.00,call,SELL,2021-01-08,913255864.0,short,2021-01-07
85,4.009799862757171e+17,01/07/2021 14:16:49 EST,UVXY,ProShares Ultra VIX Short-Term Futures,10.70,100,1069.97,STOCK,,,BUY,,913424717.0,long,2021-01-07
86,4.009786519123804e+17,01/07/2021 14:11:31 EST,TIGR,UP Fintech Holding,9.26,500,4630.00,STOCK,,,SELL,,925306034.0,short,2021-01-07
87,4.0097862407059866e+17,01/07/2021 14:11:25 EST,TIGR,UP Fintech Holding,0.45,5,225.00,OPTION,10.00,call,BUY,2021-01-15,925306034.0,long,2021-01-07
88,4.0097187325026304e+17,01/07/2021 13:45:17 EST,TIGR,UP Fintech Holding,9.38,100,938.00,STOCK,,,SELL,,925306034.0,short,2021-01-07
89,4.0095670498187264e+17,01/07/2021 12:44:19 EST,IIPR,Innovative Indl,171.66,5,858.32,STOCK,,,BUY,,925174192.0,long,2021-01-07
90,4.0092981699342336e+17,01/07/2021 10:57:28 EST,PLTR,Palantir Technologies Inc.,0.67,1,67.00,OPTION,23.50,put,SELL,2021-01-15,950172475.0,long,2021-01-07
91,4.009289113718456e+17,01/07/2021 10:53:53 EST,PLTR,Palantir Technologies Inc.,1.17,1,117.00,OPTION,23.50,call,BUY,2021-01-08,950172475.0,long,2021-01-07
92,4.0092852540360294e+17,01/07/2021 10:52:20 EST,TIGR,UP Fintech Holding,9.66,100,966.00,STOCK,,,SELL,,925306034.0,short,2021-01-07
93,4.009237183034081e+17,01/07/2021 10:33:14 EST,JD,JD.com,86.20,10,862.00,STOCK,,,BUY,,913255864.0,long,2021-01-07
94,4.009191999139103e+17,01/07/2021 10:15:16 EST,JD,JD.com,87.09,10,870.90,STOCK,,,BUY,,913255864.0,long,2021-01-07
95,4.009168269361398e+17,01/07/2021 10:05:51 EST,TDOC,TELADOC HEALTH,2.00,1,200.00,OPTION,235.00,call,SELL,2021-01-15,913254759.0,short,2021-01-07
96,4.009115226725089e+17,01/07/2021 09:44:46 EST,SQQQ,ProShares UltraPro Short QQQ,15.39,150,2308.50,STOCK,,,SELL,,913244796.0,short,2021-01-07
97,4.00909638138069e+17,01/07/2021 09:37:18 EST,TDOC,TELADOC HEALTH,4.00,1,400.00,OPTION,212.50,call,BUY,2021-01-08,913254759.0,long,2021-01-07
98,4.006346443971379e+17,01/06/2021 15:25:34 EST,RKT,Rocket Companies,19.29,200,3858.00,STOCK,,,SELL,,950168855.0,short,2021-01-06
99,4.006345523279626e+17,01/06/2021 15:24:11 EST,TIGR,UP Fintech Holding,0.40,5,200.00,OPTION,10.00,call,SELL,2021-01-15,925306034.0,short,2021-01-06
100,4.0063445576247296e+17,01/06/2021 15:23:48 EST,PLTR,Palantir Technologies Inc.,0.57,1,57.00,OPTION,23.50,call,SELL,2021-01-08,950172475.0,short,2021-01-06
101,4.006321419327611e+17,01/06/2021 15:14:37 EST,NVDA,Nvidia,514.23,5,2571.15,STOCK,,,BUY,,913257561.0,long,2021-01-06
102,4.0062017138919424e+17,01/06/2021 14:27:03 EST,RUN,Sunrun,0.75,1,75.00,OPTION,100.00,call,SELL,2021-01-15,913256036.0,short,2021-01-06
103,4.0062008670612685e+17,01/06/2021 14:55:13 EST,TDOC,TELADOC HEALTH,0.80,1,80.00,OPTION,212.50,call,SELL,2021-01-08,913254759.0,short,2021-01-06
104,4.0061993080387994e+17,01/06/2021 14:26:05 EST,SQQQ,ProShares UltraPro Short QQQ,0.51,1,51.00,OPTION,15.50,call,BUY,2021-01-08,913244796.0,long,2021-01-06
105,4.005847364703191e+17,01/06/2021 12:06:14 EST,SQQQ,ProShares UltraPro Short QQQ,0.30,1,30.00,OPTION,15.50,call,SELL,2021-01-08,913244796.0,short,2021-01-06
106,4.0057842998616064e+17,01/06/2021 11:41:11 EST,UBER,Uber,0.82,1,82.00,OPTION,53.00,call,SELL,2021-01-08,950121423.0,short,2021-01-06
107,4.005778826671964e+17,01/06/2021 11:39:00 EST,SQQQ,ProShares UltraPro Short QQQ,15.64,150,2345.25,STOCK,,,BUY,,913244796.0,long,2021-01-06
108,4.00575028095189e+17,01/06/2021 12:14:55 EST,TIGR,UP Fintech Holding,9.35,100,935.00,STOCK,,,BUY,,925306034.0,long,2021-01-06
109,4.005734802040914e+17,01/06/2021 11:21:58 EST,TIGR,UP Fintech Holding,9.44,100,944.00,STOCK,,,BUY,,925306034.0,long,2021-01-06
110,4.005720227841188e+17,01/06/2021 11:16:36 EST,LU,Lufax Holding Ltd,13.67,300,4101.00,STOCK,,,SELL,,950176591.0,short,2021-01-06
111,4.00568958706561e+17,01/06/2021 11:03:33 EST,TIGR,UP Fintech Holding,9.69,50,484.50,STOCK,,,BUY,,925306034.0,long,2021-01-06
112,4.005680241612022e+17,01/06/2021 10:59:50 EST,TIGR,UP Fintech Holding,9.70,50,485.00,STOCK,,,BUY,,925306034.0,long,2021-01-06
113,4.0056432300662374e+17,01/06/2021 10:45:15 EST,PLTR,Palantir Technologies Inc.,0.23,3,69.00,OPTION,25.50,call,SELL,2021-01-08,950172475.0,short,2021-01-06
114,4.005641236345979e+17,01/06/2021 10:44:28 EST,TIGR,UP Fintech Holding,9.87,100,987.00,STOCK,,,SELL,,925306034.0,short,2021-01-06
115,4.005640776272036e+17,01/06/2021 10:44:09 EST,JD,JD.com,91.11,5,455.57,STOCK,,,SELL,,913255864.0,short,2021-01-06
116,4.005634654895391e+17,01/06/2021 10:41:43 EST,RKT,Rocket Companies,0.69,5,345.00,OPTION,20.00,call,BUY,2021-01-22,950168855.0,long,2021-01-06
117,4.0055865428739686e+17,01/06/2021 10:22:36 EST,JD,JD.com,90.61,5,453.05,STOCK,,,BUY,,913255864.0,long,2021-01-06
118,4.0026074917329306e+17,01/05/2021 14:38:50 EST,TIGR,UP Fintech Holding,9.66,100,966.47,STOCK,,,SELL,,925306034.0,short,2021-01-05
119,4.002595684767048e+17,01/05/2021 14:34:08 EST,UBER,Uber,1.80,1,180.00,OPTION,52.50,call,BUY,2021-01-08,950121423.0,long,2021-01-05
120,4.002591028124795e+17,01/05/2021 14:32:17 EST,RKT,Rocket Companies,1.14,10,1140.00,OPTION,19.50,call,BUY,2021-01-22,950168855.0,long,2021-01-05
121,4.002297796111524e+17,01/05/2021 12:35:46 EST,RKT,Rocket Companies,19.98,100,1997.89,STOCK,,,BUY,,950168855.0,long,2021-01-05
122,4.002296935440671e+17,01/05/2021 12:36:22 EST,RKT,Rocket Companies,19.95,100,1995.00,STOCK,,,BUY,,950168855.0,long,2021-01-05
123,4.002262966695035e+17,01/05/2021 12:22:28 EST,NIO,NIO Inc.,2.50,1,250.00,OPTION,50.00,put,SELL,2021-01-15,950076017.0,long,2021-01-05
124,4.0022340082970214e+17,01/05/2021 12:10:25 EST,TIGR,UP Fintech Holding,9.37,100,937.11,STOCK,,,SELL,,925306034.0,short,2021-01-05
125,4.00202198744662e+17,01/05/2021 10:46:11 EST,AMZN,Amazon.com,3192.68,1,3192.68,STOCK,,,SELL,,913256180.0,short,2021-01-05
126,4.0020129100497715e+17,01/05/2021 10:42:34 EST,TIGR,UP Fintech Holding,9.13,100,913.00,STOCK,,,SELL,,925306034.0,short,2021-01-05
127,3.9991273392912794e+17,01/04/2021 15:35:56 EST,UBER,Uber,50.94,50,2547.00,STOCK,,,SELL,,950121423.0,short,2021-01-04
128,3.9988924389749146e+17,01/04/2021 14:02:45 EST,TDOC,TELADOC HEALTH,9.40,1,940.00,OPTION,197.50,call,BUY,2021-01-15,913254759.0,long,2021-01-04
129,3.9988850202986496e+17,01/04/2021 13:59:39 EST,AMZN,Amazon.com,3188.36,1,3188.36,STOCK,,,BUY,,913256180.0,long,2021-01-04
130,3.998869928312013e+17,01/04/2021 13:53:39 EST,NIO,NIO Inc.,1.23,1,123.00,OPTION,50.00,put,SELL,2021-01-08,950076017.0,long,2021-01-04
131,3.998854187257897e+17,01/04/2021 13:49:59 EST,HYLN,Hyliion Holdings Corporation,15.49,100,1549.00,STOCK,,,SELL,,950122538.0,short,2021-01-04
132,3.998852179193037e+17,01/04/2021 13:46:58 EST,HYLN,Hyliion Holdings Corporation,15.48,100,1548.00,STOCK,,,SELL,,950122538.0,short,2021-01-04
133,3.998850419639583e+17,01/04/2021 13:45:54 EST,HYLN,Hyliion Holdings Corporation,0.05,2,10.00,OPTION,20.00,call,BUY,2021-01-08,950122538.0,long,2021-01-04
134,3.998849821364265e+17,01/04/2021 13:45:40 EST,HYLN,Hyliion Holdings Corporation,14.58,1,1458.00,OPTION,30.00,put,BUY,2021-01-15,950122538.0,short,2021-01-04
135,3.9987516317856154e+17,01/04/2021 13:06:38 EST,TIGR,UP Fintech Holding,8.33,100,833.47,STOCK,,,SELL,,925306034.0,short,2021-01-04
136,3.998653836638003e+17,01/04/2021 12:40:29 EST,IIPR,Innovative Indl,175.22,10,1752.20,STOCK,,,BUY,,925174192.0,long,2021-01-04
137,3.998575948999516e+17,01/04/2021 12:24:59 EST,TIGR,UP Fintech Holding,7.47,100,747.00,STOCK,,,SELL,,925306034.0,short,2021-01-04
138,3.998465311942451e+17,01/04/2021 11:12:52 EST,TDAC,Trident Acquisitions,11.98,100,1198.00,STOCK,,,BUY,,950102449.0,long,2021-01-04
139,3.998455118903542e+17,01/04/2021 11:08:49 EST,TIGR,UP Fintech Holding,7.39,100,739.00,STOCK,,,BUY,,925306034.0,long,2021-01-04
140,3.9984535757758054e+17,01/04/2021 11:08:13 EST,BEKE,KE Holdings Inc.,0.85,1,85.00,OPTION,65.00,call,SELL,2021-01-15,950169866.0,short,2021-01-04
141,3.99844992534868e+17,01/04/2021 11:06:46 EST,PLTR,Palantir Technologies Inc.,0.75,1,75.00,OPTION,23.50,put,SELL,2021-01-08,950172475.0,long,2021-01-04
142,3.998443841930035e+17,01/04/2021 11:04:21 EST,UBER,Uber,49.84,50,2491.91,STOCK,,,BUY,,950121423.0,long,2021-01-04
143,3.998416649710469e+17,01/04/2021 10:54:42 EST,FROG,JFrog Ltd,60.72,10,607.20,STOCK,,,SELL,,950172454.0,short,2021-01-04
144,3.998410854105252e+17,01/04/2021 10:51:14 EST,HYLN,Hyliion Holdings Corporation,15.98,150,2397.00,STOCK,,,SELL,,950122538.0,short,2021-01-04
145,3.998387949137633e+17,01/04/2021 10:42:08 EST,FROG,JFrog Ltd,60.76,50,3038.00,STOCK,,,SELL,,950172454.0,short,2021-01-04
146,3.998340320676577e+17,01/04/2021 10:23:12 EST,PLTR,Palantir Technologies Inc.,0.65,3,195.00,OPTION,25.00,call,BUY,2021-01-08,950172475.0,long,2021-01-04
147,3.998263275296973e+17,01/04/2021 09:52:36 EST,NVDA,Nvidia,533.16,5,2665.80,STOCK,,,BUY,,913257561.0,long,2021-01-04
148,3.9852303777693696e+17,12/31/2020 19:33:48 EST,TDAC,Trident Acquisitions,12.48,100,1248.00,STOCK,,,BUY,,950102449.0,long,2020-12-31
149,3.98466130835968e+17,12/31/2020 15:48:05 EST,BEKE,KE Holdings Inc.,61.04,50,3052.00,STOCK,,,BUY,,950169866.0,long,2020-12-31
150,3.984629353258271e+17,12/31/2020 15:34:58 EST,UBER,Uber,0.83,1,83.00,OPTION,52.50,call,SELL,2021-01-08,950121423.0,short,2020-12-31
151,3.9842655951549235e+17,12/31/2020 13:10:25 EST,TIGR,UP Fintech Holding,7.83,100,782.56,STOCK,,,BUY,,925306034.0,long,2020-12-31
152,3.984121310174454e+17,12/31/2020 12:13:05 EST,LU,Lufax Holding Ltd,14.19,100,1419.00,STOCK,,,BUY,,950176591.0,long,2020-12-31
153,3.9841019041785856e+17,12/31/2020 12:05:23 EST,JD,JD.com,87.07,10,870.67,STOCK,,,BUY,,913255864.0,long,2020-12-31
154,3.984067581853573e+17,12/31/2020 11:51:52 EST,RKT,Rocket Companies,20.60,200,4120.00,STOCK,,,SELL,,950168855.0,short,2020-12-31
155,3.984060008072888e+17,12/31/2020 11:48:53 EST,TDOC,TELADOC HEALTH,8.50,1,850.00,OPTION,197.50,call,SELL,2021-01-15,913254759.0,short,2020-12-31
156,3.984059184437453e+17,12/31/2020 11:48:24 EST,TDOC,TELADOC HEALTH,0.05,1,5.00,OPTION,210.00,call,BUY,2020-12-31,913254759.0,long,2020-12-31
157,3.984043522319319e+17,12/31/2020 11:42:11 EST,BEKE,KE Holdings Inc.,62.14,50,3107.00,STOCK,,,BUY,,950169866.0,long,2020-12-31
158,3.9840417873873715e+17,12/31/2020 11:41:29 EST,LU,Lufax Holding Ltd,14.55,200,2909.78,STOCK,,,BUY,,950176591.0,long,2020-12-31
159,3.983967760060539e+17,12/31/2020 11:12:04 EST,IMMR,Immersion,10.90,300,3270.00,STOCK,,,SELL,,913256874.0,short,2020-12-31
160,3.98388279839359e+17,12/31/2020 10:38:18 EST,RKT,Rocket Companies,0.41,10,410.00,OPTION,22.00,call,SELL,2021-01-15,950168855.0,short,2020-12-31
161,3.983878712512553e+17,12/31/2020 10:36:41 EST,HYLN,Hyliion Holdings Corporation,16.54,50,826.95,STOCK,,,BUY,,950122538.0,long,2020-12-31
162,3.9838727036267315e+17,12/31/2020 10:34:18 EST,AMZN,Amazon.com,3267.05,1,3267.05,STOCK,,,SELL,,913256180.0,short,2020-12-31
163,3.9838455597266944e+17,12/31/2020 10:23:30 EST,TIGR,UP Fintech Holding,7.86,100,786.00,STOCK,,,SELL,,925306034.0,short,2020-12-31
164,3.9838414194868634e+17,12/31/2020 10:21:52 EST,IMMR,Immersion,11.43,100,1143.00,STOCK,,,SELL,,913256874.0,short,2020-12-31
165,3.980953372538634e+17,12/30/2020 15:14:15 EST,RKT,Rocket Companies,0.62,10,620.00,OPTION,22.00,call,BUY,2021-01-15,950168855.0,long,2020-12-30
166,3.980937921687347e+17,12/30/2020 15:08:09 EST,RKT,Rocket Companies,21.19,100,2119.00,STOCK,,,BUY,,950168855.0,long,2020-12-30
167,3.980755741672735e+17,12/30/2020 13:55:43 EST,TDOC,TELADOC HEALTH,6.20,1,620.00,OPTION,210.00,call,SELL,2021-01-15,913254759.0,short,2020-12-30
168,3.9807000900121805e+17,12/30/2020 13:47:54 EST,RUN,Sunrun,3.20,1,320.00,OPTION,70.00,call,BUY,2021-01-15,913256036.0,long,2020-12-30
169,3.98030954834219e+17,12/30/2020 10:58:25 EST,TDOC,TELADOC HEALTH,5.30,1,530.00,OPTION,210.00,call,SELL,2021-01-15,913254759.0,short,2020-12-30
170,3.980308397677322e+17,12/30/2020 10:57:58 EST,TIGR,UP Fintech Holding,7.10,100,710.00,STOCK,,,BUY,,925306034.0,long,2020-12-30
171,3.9802712554787635e+17,12/30/2020 10:43:26 EST,TDOC,TELADOC HEALTH,5.00,1,500.00,OPTION,210.00,call,BUY,2021-01-15,913254759.0,long,2020-12-30
172,3.980233314433802e+17,12/30/2020 10:28:08 EST,CRM,Salesforce.com,222.39,5,1111.95,STOCK,,,BUY,,913255140.0,long,2020-12-30
173,3.980225506024694e+17,12/30/2020 10:25:16 EST,TIGR,UP Fintech Holding,7.23,100,723.00,STOCK,,,BUY,,925306034.0,long,2020-12-30
174,3.9802199533952205e+17,12/30/2020 10:22:59 EST,TDOC,TELADOC HEALTH,5.70,1,570.00,OPTION,210.00,call,SELL,2021-01-15,913254759.0,short,2020-12-30
175,3.98020621927211e+17,12/30/2020 10:22:23 EST,HYLN,Hyliion Holdings Corporation,16.96,50,848.00,STOCK,,,SELL,,950122538.0,short,2020-12-30
176,3.9802019073602355e+17,12/30/2020 10:15:39 EST,TIGR,UP Fintech Holding,7.28,100,728.00,STOCK,,,BUY,,925306034.0,long,2020-12-30
177,3.980174653359964e+17,12/30/2020 10:05:21 EST,TIGR,UP Fintech Holding,7.32,100,732.00,STOCK,,,BUY,,925306034.0,long,2020-12-30
178,3.9801646368587776e+17,12/30/2020 10:00:50 EST,TIGR,UP Fintech Holding,7.51,500,3755.00,STOCK,,,BUY,,925306034.0,long,2020-12-30
179,3.980149490514002e+17,12/30/2020 09:54:49 EST,TDOC,TELADOC HEALTH,200.14,10,2001.40,STOCK,,,SELL,,913254759.0,short,2020-12-30
180,3.9801012413794304e+17,12/30/2020 09:35:39 EST,HYLN,Hyliion Holdings Corporation,16.46,50,823.00,STOCK,,,BUY,,950122538.0,long,2020-12-30
181,3.980100137271337e+17,12/30/2020 09:35:13 EST,BABA,Alibaba,239.63,15,3594.45,STOCK,,,SELL,,913254558.0,short,2020-12-30
182,3.9773836857153946e+17,12/29/2020 15:35:47 EST,PLTR,Palantir Technologies Inc.,1.27,2,254.00,OPTION,25.00,call,SELL,2021-01-08,950172475.0,short,2020-12-29
183,3.9773828934957875e+17,12/29/2020 15:35:28 EST,PLTR,Palantir Technologies Inc.,0.15,2,30.00,OPTION,27.00,call,BUY,2020-12-31,950172475.0,long,2020-12-29
184,3.977002923443241e+17,12/29/2020 13:04:29 EST,RKT,Rocket Companies,20.77,100,2077.00,STOCK,,,BUY,,950168855.0,long,2020-12-29
185,3.976697145847603e+17,12/29/2020 11:02:59 EST,FROG,JFrog Ltd,63.42,10,634.20,STOCK,,,BUY,,950172454.0,long,2020-12-29
186,3.9766947416305664e+17,12/29/2020 11:02:02 EST,UBER,Uber,0.13,1,13.00,OPTION,55.00,call,BUY,2020-12-31,950121423.0,long,2020-12-29
187,3.976680054058885e+17,12/29/2020 10:56:12 EST,BABA,Alibaba,8.65,1,865.00,OPTION,250.00,call,SELL,2021-02-19,913254558.0,short,2020-12-29
188,3.9766355362604646e+17,12/29/2020 10:38:32 EST,PLTR,Palantir Technologies Inc.,0.39,1,39.00,OPTION,24.50,put,SELL,2020-12-31,950172475.0,long,2020-12-29
189,3.976628662719242e+17,12/29/2020 10:35:46 EST,NIO,NIO Inc.,0.24,1,24.00,OPTION,41.00,put,SELL,2020-12-31,950076017.0,long,2020-12-29
190,3.976584707713843e+17,12/29/2020 10:18:18 EST,BABA,Alibaba,7.40,3,2220.00,OPTION,250.00,call,SELL,2021-02-19,913254558.0,short,2020-12-29
191,3.9765093869479936e+17,12/29/2020 09:48:22 EST,RUN,Sunrun,2.75,1,275.00,OPTION,70.00,call,SELL,2021-01-15,913256036.0,short,2020-12-29
192,3.97650550272897e+17,12/29/2020 09:47:48 EST,IMMR,Immersion,10.80,100,1080.00,STOCK,,,SELL,,913256874.0,short,2020-12-29
193,3.976485603566551e+17,12/29/2020 09:39:02 EST,PLTR,Palantir Technologies Inc.,1.35,1,135.00,OPTION,25.00,call,SELL,2021-01-08,950172475.0,short,2020-12-29
194,3.976485189840568e+17,12/29/2020 09:38:46 EST,PLTR,Palantir Technologies Inc.,0.15,1,15.00,OPTION,27.50,call,BUY,2020-12-31,950172475.0,long,2020-12-29
195,3.973736175470387e+17,12/28/2020 15:26:55 EST,BABA,Alibaba,223.01,50,11150.50,STOCK,,,SELL,,913254558.0,short,2020-12-28
196,3.9734939344490906e+17,12/28/2020 13:50:09 EST,TDOC,TELADOC HEALTH,5.00,2,1000.00,OPTION,210.00,call,BUY,2021-01-15,913254759.0,long,2020-12-28
197,3.9730040948136346e+17,12/28/2020 10:35:30 EST,IMMR,Immersion,9.62,500,4811.95,STOCK,,,BUY,,913256874.0,long,2020-12-28
198,3.972974486550815e+17,12/28/2020 10:23:55 EST,FROG,JFrog Ltd,64.83,50,3241.50,STOCK,,,BUY,,950172454.0,long,2020-12-28
199,3.972967890294497e+17,12/28/2020 10:21:07 EST,RUN,Sunrun,70.66,50,3532.99,STOCK,,,BUY,,913256036.0,long,2020-12-28
200,3.9729658593286554e+17,12/28/2020 10:20:19 EST,TDOC,TELADOC HEALTH,197.11,10,1971.10,STOCK,,,BUY,,913254759.0,long,2020-12-28
201,3.972959551766282e+17,12/28/2020 10:17:48 EST,AMD,AMD,91.32,100,9132.00,STOCK,,,SELL,,913254235.0,short,2020-12-28
202,3.972955826972959e+17,12/28/2020 10:16:50 EST,RVLV,Revolve Group,30.62,100,3062.00,STOCK,,,SELL,,950090181.0,short,2020-12-28
203,3.9729541336479334e+17,12/28/2020 10:15:39 EST,RKT,Rocket Companies,0.16,8,128.00,OPTION,23.00,call,SELL,2021-01-08,950168855.0,short,2020-12-28
204,3.9729490146258944e+17,12/28/2020 10:13:37 EST,PLTR,Palantir Technologies Inc.,0.77,2,154.00,OPTION,27.00,call,SELL,2020-12-31,950172475.0,short,2020-12-28
205,3.9729459315195904e+17,12/28/2020 10:13:55 EST,HYLN,Hyliion Holdings Corporation,0.60,2,120.00,OPTION,20.00,call,SELL,2021-01-08,950122538.0,short,2020-12-28
206,3.972941524311859e+17,12/28/2020 10:10:38 EST,PLTR,Palantir Technologies Inc.,0.65,1,65.00,OPTION,27.50,call,SELL,2020-12-31,950172475.0,short,2020-12-28
207,3.972940912279593e+17,12/28/2020 10:10:24 EST,UBER,Uber,0.20,1,20.00,OPTION,55.00,call,SELL,2020-12-31,950121423.0,short,2020-12-28
208,3.9729402323829965e+17,12/28/2020 10:10:07 EST,TDOC,TELADOC HEALTH,1.32,1,132.00,OPTION,210.00,call,SELL,2020-12-31,913254759.0,short,2020-12-28
209,3.972899539245343e+17,12/28/2020 09:53:57 EST,BABA,Alibaba,222.45,10,2224.50,STOCK,,,SELL,,913254558.0,short,2020-12-28
210,3.972893716670177e+17,12/28/2020 09:51:42 EST,AMZN,Amazon.com,3193.56,1,3193.56,STOCK,,,BUY,,913256180.0,long,2020-12-28
211,3.972891044479017e+17,12/28/2020 09:50:35 EST,JD,JD.com,83.56,10,835.60,STOCK,,,BUY,,913255864.0,long,2020-12-28
212,3.9728893407534694e+17,12/28/2020 09:49:54 EST,BABA,Alibaba,223.60,10,2236.00,STOCK,,,SELL,,913254558.0,short,2020-12-28
213,3.9728511886086144e+17,12/28/2020 09:34:44 EST,RUN,Sunrun,71.83,50,3591.50,STOCK,,,BUY,,913256036.0,long,2020-12-28
214,3.958698322827059e+17,12/24/2020 11:50:54 EST,BABA,Alibaba,6.68,2,1336.00,OPTION,250.00,call,BUY,2021-02-19,913254558.0,long,2020-12-24
215,3.958609723984691e+17,12/24/2020 11:15:41 EST,RKT,Rocket Companies,20.86,301,6278.86,STOCK,,,SELL,,950168855.0,short,2020-12-24
216,3.95847864145748e+17,12/24/2020 10:24:05 EST,BABA,Alibaba,219.28,10,2192.80,STOCK,,,BUY,,913254558.0,long,2020-12-24
217,3.958424188528312e+17,12/24/2020 10:02:00 EST,BABA,Alibaba,6.90,1,690.00,OPTION,250.00,call,BUY,2021-02-19,913254558.0,long,2020-12-24
218,3.958423058498355e+17,12/24/2020 10:01:31 EST,BABA,Alibaba,6.83,1,683.00,OPTION,250.00,call,BUY,2021-02-19,913254558.0,long,2020-12-24
219,3.958373359813386e+17,12/24/2020 09:41:46 EST,TDOC,TELADOC HEALTH,0.20,1,20.00,OPTION,215.00,call,SELL,2020-12-24,913254759.0,short,2020-12-24
220,3.9583558626443674e+17,12/24/2020 09:34:49 EST,BABA,Alibaba,226.35,10,2263.50,STOCK,,,BUY,,913254558.0,long,2020-12-24
221,3.9580270592844595e+17,12/24/2020 08:00:29 EST,BABA,Alibaba,233.00,10,2330.00,STOCK,,,BUY,,913254558.0,long,2020-12-24
222,3.958013660496609e+17,12/24/2020 07:18:57 EST,BABA,Alibaba,235.70,20,4714.00,STOCK,,,BUY,,913254558.0,long,2020-12-24
223,3.9554439564814336e+17,12/23/2020 14:17:43 EST,RKT,Rocket Companies,0.46,5,230.00,OPTION,23.00,call,BUY,2021-01-08,950168855.0,long,2020-12-23
224,3.955416656804823e+17,12/23/2020 14:10:58 EST,TDOC,TELADOC HEALTH,10.50,1,1050.00,OPTION,230.00,call,SELL,2021-02-19,913254759.0,short,2020-12-23
225,3.9553854973628826e+17,12/23/2020 13:54:30 EST,RKT,Rocket Companies,0.49,3,147.00,OPTION,23.00,call,BUY,2021-01-08,950168855.0,long,2020-12-23
226,3.955197671689953e+17,12/23/2020 12:39:51 EST,RKT,Rocket Companies,21.51,100,2151.22,STOCK,,,SELL,,950168855.0,short,2020-12-23
227,3.955196186025697e+17,12/23/2020 12:39:16 EST,JD,JD.com,84.49,10,844.88,STOCK,,,BUY,,913255864.0,long,2020-12-23
228,3.955191962570957e+17,12/23/2020 12:37:47 EST,TDOC,TELADOC HEALTH,10.20,1,1020.00,OPTION,230.00,call,SELL,2021-02-19,913254759.0,short,2020-12-23
229,3.9551222404880384e+17,12/23/2020 12:09:53 EST,PLTR,Palantir Technologies Inc.,0.16,2,32.00,OPTION,30.00,call,SELL,2020-12-24,950172475.0,short,2020-12-23
230,3.9550349463258726e+17,12/23/2020 11:35:48 EST,IIPR,Innovative Indl,186.50,10,1865.00,STOCK,,,BUY,,925174192.0,long,2020-12-23
231,3.954794395610071e+17,12/23/2020 09:59:50 EST,UBER,Uber,53.17,30,1595.10,STOCK,,,BUY,,950121423.0,long,2020-12-23
232,3.9547935525124915e+17,12/23/2020 09:59:17 EST,RKT,Rocket Companies,0.24,2,48.00,OPTION,21.50,call,BUY,2020-12-24,950168855.0,long,2020-12-23
233,3.9547912886790554e+17,12/23/2020 09:58:31 EST,UBER,Uber,53.07,10,530.70,STOCK,,,BUY,,950121423.0,long,2020-12-23
234,3.9547836443920384e+17,12/23/2020 09:55:20 EST,UBER,Uber,53.36,10,533.55,STOCK,,,BUY,,950121423.0,long,2020-12-23
235,3.954767929216205e+17,12/23/2020 09:49:06 EST,RKT,Rocket Companies,0.11,2,22.00,OPTION,21.50,call,SELL,2020-12-24,950168855.0,short,2020-12-23
236,3.9547313409182925e+17,12/23/2020 09:34:33 EST,BABA,Alibaba,253.78,5,1268.90,STOCK,,,BUY,,913254558.0,long,2020-12-23
237,3.954724943597568e+17,12/23/2020 09:32:01 EST,PLTR,Palantir Technologies Inc.,0.80,1,80.00,OPTION,29.00,call,BUY,2020-12-24,950172475.0,long,2020-12-23
238,3.952053159492485e+17,12/22/2020 15:50:21 EST,JD,JD.com,4.30,2,860.00,OPTION,80.00,call,SELL,2021-01-08,913255864.0,short,2020-12-22
239,3.9517154780492186e+17,12/22/2020 13:36:10 EST,FROG,JFrog Ltd,65.90,10,659.01,STOCK,,,SELL,,950172454.0,short,2020-12-22
240,3.9514503271521075e+17,12/22/2020 11:51:45 EST,FROG,JFrog Ltd,66.11,10,661.10,STOCK,,,BUY,,950172454.0,long,2020-12-22
241,3.9514054876522496e+17,12/22/2020 11:32:59 EST,RKT,Rocket Companies,0.39,5,195.00,OPTION,22.00,call,SELL,2020-12-31,950168855.0,short,2020-12-22
242,3.951362195220808e+17,12/22/2020 11:15:47 EST,PLTR,Palantir Technologies Inc.,27.17,50,1358.50,STOCK,,,BUY,,950172475.0,long,2020-12-22
243,3.9512305106845696e+17,12/22/2020 10:23:27 EST,FUBO,fuboTV Inc.,58.15,50,2907.46,STOCK,,,BUY,,925241477.0,long,2020-12-22
244,3.9512249514695475e+17,12/22/2020 10:21:14 EST,FUBO,fuboTV Inc.,58.50,50,2925.00,STOCK,,,SHORT,,925241477.0,short,2020-12-22
245,3.9511775948834816e+17,12/22/2020 10:02:25 EST,FUBO,fuboTV Inc.,57.35,50,2867.50,STOCK,,,BUY,,925241477.0,long,2020-12-22
246,3.951168218978427e+17,12/22/2020 09:58:42 EST,FUBO,fuboTV Inc.,58.00,50,2900.00,STOCK,,,SHORT,,925241477.0,short,2020-12-22
247,3.951147615634391e+17,12/22/2020 09:50:48 EST,HYLN,Hyliion Holdings Corporation,0.50,1,50.00,OPTION,17.50,call,BUY,2020-12-24,950122538.0,long,2020-12-22
248,3.951140778080092e+17,12/22/2020 09:47:48 EST,PLTR,Palantir Technologies Inc.,0.77,2,154.00,OPTION,29.00,call,SELL,2020-12-24,950172475.0,short,2020-12-22
249,3.9481451753353626e+17,12/21/2020 13:57:27 EST,RUN,Sunrun,64.90,50,3245.00,STOCK,,,SELL,,913256036.0,short,2020-12-21
250,3.94814236636758e+17,12/21/2020 13:56:20 EST,PLTR,Palantir Technologies Inc.,27.89,50,1394.56,STOCK,,,SELL,,950172475.0,short,2020-12-21
251,3.947969902459617e+17,12/21/2020 12:54:47 EST,TDOC,TELADOC HEALTH,6.10,1,610.00,OPTION,230.00,call,BUY,2021-02-19,913254759.0,long,2020-12-21
252,3.94796522652373e+17,12/21/2020 12:59:30 EST,TDOC,TELADOC HEALTH,6.00,1,600.00,OPTION,230.00,call,BUY,2021-02-19,913254759.0,long,2020-12-21
253,3.947928389251809e+17,12/21/2020 12:31:37 EST,SQQQ,ProShares UltraPro Short QQQ,16.12,100,1612.00,STOCK,,,SELL,,913244796.0,short,2020-12-21
254,3.9478896165187584e+17,12/21/2020 12:18:05 EST,JD,JD.com,3.20,2,640.00,OPTION,80.00,call,SELL,2021-01-08,913255864.0,short,2020-12-21
255,3.9478824276906394e+17,12/21/2020 12:13:03 EST,SQQQ,ProShares UltraPro Short QQQ,16.26,100,1626.00,STOCK,,,BUY,,913244796.0,long,2020-12-21
256,3.9478089568230605e+17,12/21/2020 11:43:51 EST,JD,JD.com,3.30,1,330.00,OPTION,80.00,call,SELL,2021-01-08,913255864.0,short,2020-12-21
257,3.947719083038597e+17,12/21/2020 11:08:08 EST,JD,JD.com,2.88,5,1440.00,OPTION,80.00,call,BUY,2021-01-08,913255864.0,long,2020-12-21
258,3.947670707529482e+17,12/21/2020 10:48:55 EST,SQQQ,ProShares UltraPro Short QQQ,16.68,100,1668.13,STOCK,,,SELL,,913244796.0,short,2020-12-21
259,3.94758467967062e+17,12/21/2020 10:28:17 EST,RVLV,Revolve Group,0.60,1,60.00,OPTION,31.00,call,SELL,2020-12-24,950090181.0,short,2020-12-21
260,3.94757047096193e+17,12/21/2020 10:09:05 EST,HYLN,Hyliion Holdings Corporation,0.50,1,50.00,OPTION,17.50,call,SELL,2020-12-24,950122538.0,short,2020-12-21
261,3.947569426748416e+17,12/21/2020 10:08:49 EST,AMD,AMD,0.45,1,45.00,OPTION,97.00,call,SELL,2020-12-24,913254235.0,short,2020-12-21
262,3.9474237995065754e+17,12/21/2020 09:10:48 EST,JD,JD.com,79.89,10,798.90,STOCK,,,BUY,,913255864.0,long,2020-12-21
263,3.947421930650665e+17,12/21/2020 09:10:04 EST,BABA,Alibaba,255.70,5,1278.50,STOCK,,,BUY,,913254558.0,long,2020-12-21
264,3.9372360242119066e+17,12/18/2020 13:44:17 EST,RKT,Rocket Companies,0.61,5,305.00,OPTION,22.00,call,BUY,2020-12-31,950168855.0,long,2020-12-18
265,3.936864708518953e+17,12/18/2020 11:15:01 EST,IIPR,Innovative Indl,190.11,10,1901.10,STOCK,,,SELL,,925174192.0,short,2020-12-18
266,3.936842846212424e+17,12/18/2020 11:06:51 EST,AMD,AMD,0.14,1,14.00,OPTION,99.00,call,SELL,2020-12-18,913254235.0,short,2020-12-18
267,3.9368330607334605e+17,12/18/2020 11:02:25 EST,UBER,Uber,50.10,50,2504.91,STOCK,,,BUY,,950121423.0,long,2020-12-18
268,3.9368315980118426e+17,12/18/2020 11:01:50 EST,AMD,AMD,0.59,1,59.00,OPTION,97.00,call,BUY,2020-12-18,913254235.0,long,2020-12-18
269,3.936820878502871e+17,12/18/2020 10:57:35 EST,SQQQ,ProShares UltraPro Short QQQ,15.80,100,1580.00,STOCK,,,SELL,,913244796.0,short,2020-12-18
270,3.9368180425661235e+17,12/18/2020 10:56:27 EST,HYLN,Hyliion Holdings Corporation,17.63,100,1762.78,STOCK,,,BUY,,950122538.0,long,2020-12-18
271,3.9367761920527155e+17,12/18/2020 10:39:49 EST,BABA,Alibaba,260.06,5,1300.28,STOCK,,,BUY,,913254558.0,long,2020-12-18
272,3.93674256145236e+17,12/18/2020 10:26:27 EST,HYLN,Hyliion Holdings Corporation,17.84,100,1784.00,STOCK,,,SELL,,950122538.0,short,2020-12-18
273,3.936741107370926e+17,12/18/2020 10:25:53 EST,RKT,Rocket Companies,1.63,4,652.00,OPTION,20.00,call,SELL,2020-12-18,950168855.0,short,2020-12-18
274,3.936685590514647e+17,12/18/2020 10:08:39 EST,SQQQ,ProShares UltraPro Short QQQ,15.87,100,1587.00,STOCK,,,BUY,,913244796.0,long,2020-12-18
275,3.936663675234058e+17,12/18/2020 09:55:07 EST,SQQQ,ProShares UltraPro Short QQQ,15.78,100,1577.71,STOCK,,,BUY,,913244796.0,long,2020-12-18
276,3.9366246647260774e+17,12/18/2020 09:43:45 EST,RKT,Rocket Companies,1.90,4,760.00,OPTION,20.00,call,SELL,2020-12-18,950168855.0,short,2020-12-18
277,3.936616636701983e+17,12/18/2020 09:36:25 EST,AMD,AMD,0.42,1,42.00,OPTION,97.00,call,SELL,2020-12-18,913254235.0,short,2020-12-18
278,3.9366115519054234e+17,12/18/2020 09:34:24 EST,RKT,Rocket Companies,0.13,4,52.00,OPTION,22.00,call,SELL,2020-12-18,950168855.0,short,2020-12-18
279,3.933920082169774e+17,12/17/2020 15:45:11 EST,RKT,Rocket Companies,2.37,2,474.00,OPTION,20.00,call,SELL,2020-12-18,950168855.0,short,2020-12-17
280,3.933726642002125e+17,12/17/2020 14:28:22 EST,TDOC,TELADOC HEALTH,0.40,1,40.00,OPTION,202.50,call,SELL,2020-12-18,913254759.0,short,2020-12-17
281,3.933661011420324e+17,12/17/2020 14:01:58 EST,RUN,Sunrun,61.57,50,3078.49,STOCK,,,SELL,,913256036.0,short,2020-12-17
282,3.9336578798270464e+17,12/17/2020 14:00:43 EST,NIO,NIO Inc.,0.22,1,22.00,OPTION,36.00,put,BUY,2020-12-24,950076017.0,short,2020-12-17
283,3.933333356544287e+17,12/17/2020 11:51:46 EST,LMND,"Lemonade, Inc.",99.23,50,4961.26,STOCK,,,SELL,,950166007.0,short,2020-12-17
284,3.9332464171789926e+17,12/17/2020 11:22:40 EST,LMND,"Lemonade, Inc.",99.89,10,998.90,STOCK,,,SELL,,950166007.0,short,2020-12-17
285,3.9332454976619725e+17,12/17/2020 11:16:51 EST,LMND,"Lemonade, Inc.",99.63,10,996.30,STOCK,,,SELL,,950166007.0,short,2020-12-17
286,3.933239283716383e+17,12/17/2020 11:14:23 EST,RUN,Sunrun,60.19,50,3009.50,STOCK,,,BUY,,913256036.0,long,2020-12-17
287,3.9332298780738765e+17,12/17/2020 11:10:39 EST,RKT,Rocket Companies,2.00,2,400.00,OPTION,20.00,call,BUY,2020-12-18,950168855.0,long,2020-12-17
288,3.933212334432338e+17,12/17/2020 11:03:40 EST,TDOC,TELADOC HEALTH,7.90,1,790.00,OPTION,190.00,call,BUY,2020-12-24,913254759.0,long,2020-12-17
289,3.933201306432512e+17,12/17/2020 10:59:17 EST,RUN,Sunrun,60.87,50,3043.50,STOCK,,,BUY,,913256036.0,long,2020-12-17
290,3.933035292776694e+17,12/17/2020 09:53:35 EST,LMND,"Lemonade, Inc.",100.00,10,1000.00,STOCK,,,SELL,,950166007.0,short,2020-12-17
291,3.933030867073065e+17,12/17/2020 09:51:34 EST,RKT,Rocket Companies,2.20,2,440.00,OPTION,20.00,call,BUY,2020-12-18,950168855.0,long,2020-12-17
292,3.933025340532408e+17,12/17/2020 09:49:36 EST,LMND,"Lemonade, Inc.",98.98,10,989.80,STOCK,,,SELL,,950166007.0,short,2020-12-17
293,3.933019807784059e+17,12/17/2020 09:47:52 EST,RKT,Rocket Companies,2.25,3,675.00,OPTION,20.00,call,BUY,2020-12-18,950168855.0,long,2020-12-17
294,3.9302512138991206e+17,12/16/2020 15:30:34 EST,LMND,"Lemonade, Inc.",94.99,10,949.90,STOCK,,,SELL,,950166007.0,short,2020-12-16
295,3.9302501749282e+17,12/16/2020 15:26:37 EST,RUN,Sunrun,62.07,50,3103.50,STOCK,,,SELL,,913256036.0,short,2020-12-16
296,3.930007879633224e+17,12/16/2020 13:50:20 EST,LMND,"Lemonade, Inc.",2.10,1,210.00,OPTION,95.00,call,BUY,2020-12-18,950166007.0,long,2020-12-16
297,3.929971802536673e+17,12/16/2020 13:36:00 EST,RKT,Rocket Companies,0.50,5,250.00,OPTION,22.50,call,SELL,2020-12-18,950168855.0,short,2020-12-16
298,3.9299442933970534e+17,12/16/2020 13:25:04 EST,RKT,Rocket Companies,0.39,5,195.00,OPTION,22.50,call,BUY,2020-12-18,950168855.0,long,2020-12-16
299,3.929940349577052e+17,12/16/2020 13:23:30 EST,RKT,Rocket Companies,0.11,4,44.00,OPTION,23.50,call,BUY,2020-12-18,950168855.0,long,2020-12-16
300,3.9297852133871206e+17,12/16/2020 12:21:51 EST,AMD,AMD,0.34,1,34.00,OPTION,100.00,call,BUY,2020-12-18,913254235.0,long,2020-12-16
301,3.9297797971144294e+17,12/16/2020 12:19:44 EST,TDOC,TELADOC HEALTH,10.80,1,1080.00,OPTION,180.00,call,SELL,2020-12-24,913254759.0,short,2020-12-16
302,3.9297789200020685e+17,12/16/2020 12:19:21 EST,RUN,Sunrun,62.02,50,3101.00,STOCK,,,SELL,,913256036.0,short,2020-12-16
303,3.929555443416392e+17,12/16/2020 10:50:33 EST,TDOC,TELADOC HEALTH,4.50,1,450.00,OPTION,190.00,call,SELL,2020-12-24,913254759.0,short,2020-12-16
304,3.929553644521267e+17,12/16/2020 10:49:50 EST,TDOC,TELADOC HEALTH,10.00,1,1000.00,OPTION,180.00,call,BUY,2020-12-24,913254759.0,long,2020-12-16
305,3.929520093612114e+17,12/16/2020 10:36:30 EST,RUN,Sunrun,60.10,100,6010.00,STOCK,,,BUY,,913256036.0,long,2020-12-16
306,3.926335058482463e+17,12/15/2020 13:30:53 EST,RKT,Rocket Companies,0.14,4,56.00,OPTION,23.50,call,SELL,2020-12-18,950168855.0,short,2020-12-15
307,3.926078261800919e+17,12/15/2020 11:48:51 EST,RKT,Rocket Companies,2.46,2,492.00,OPTION,20.00,call,SELL,2020-12-18,950168855.0,short,2020-12-15
308,3.9260697573044634e+17,12/15/2020 11:45:28 EST,RUN,Sunrun,61.15,50,3057.50,STOCK,,,SELL,,913256036.0,short,2020-12-15
309,3.9260344441583616e+17,12/15/2020 11:31:26 EST,HYLN,Hyliion Holdings Corporation,15.61,100,1561.00,STOCK,,,BUY,,950122538.0,long,2020-12-15
310,3.9260216215005184e+17,12/15/2020 11:26:20 EST,AMD,AMD,0.52,1,52.00,OPTION,100.00,call,SELL,2020-12-18,913254235.0,short,2020-12-15
311,3.9259710801791795e+17,12/15/2020 11:06:48 EST,JD,JD.com,0.83,4,332.00,OPTION,83.00,call,SELL,2020-12-24,913255864.0,short,2020-12-15
312,3.925959035312128e+17,12/15/2020 11:01:32 EST,RKT,Rocket Companies,2.45,2,490.00,OPTION,20.00,call,SELL,2020-12-18,950168855.0,short,2020-12-15
313,3.9259036954557645e+17,12/15/2020 10:39:29 EST,RUN,Sunrun,60.89,50,3044.67,STOCK,,,SELL,,913256036.0,short,2020-12-15
314,3.925884221763502e+17,12/15/2020 10:31:45 EST,PLTR,Palantir Technologies Inc.,0.33,1,33.00,OPTION,28.50,call,SELL,2020-12-18,950172475.0,short,2020-12-15
315,3.92588334528e+17,12/15/2020 10:31:24 EST,PLTR,Palantir Technologies Inc.,25.85,100,2585.00,STOCK,,,BUY,,950172475.0,long,2020-12-15
316,3.9258360317690675e+17,12/15/2020 10:14:22 EST,RVLV,Revolve Group,2.90,1,290.00,OPTION,24.00,call,BUY,2020-12-18,950090181.0,long,2020-12-15
317,3.9258321581612646e+17,12/15/2020 10:11:27 EST,TDOC,TELADOC HEALTH,2.20,1,220.00,OPTION,200.00,call,BUY,2020-12-18,913254759.0,long,2020-12-15
318,3.92574634513408e+17,12/15/2020 09:36:57 EST,RKT,Rocket Companies,0.68,2,136.00,OPTION,22.00,call,BUY,2020-12-18,950168855.0,long,2020-12-15
319,3.923072171744584e+17,12/14/2020 15:54:29 EST,RKT,Rocket Companies,1.86,2,372.00,OPTION,20.00,call,BUY,2020-12-18,950168855.0,long,2020-12-14
320,3.9230468554704896e+17,12/14/2020 15:46:25 EST,RKT,Rocket Companies,1.92,3,576.00,OPTION,20.00,call,BUY,2020-12-18,950168855.0,long,2020-12-14
321,3.923023350170911e+17,12/14/2020 15:34:56 EST,RVLV,Revolve Group,0.83,1,83.00,OPTION,24.00,call,SELL,2020-12-18,950090181.0,short,2020-12-14
322,3.922952614702121e+17,12/14/2020 15:06:50 EST,RKT,Rocket Companies,0.65,2,130.00,OPTION,22.00,call,SELL,2020-12-18,950168855.0,short,2020-12-14
323,3.922843202800968e+17,12/14/2020 14:23:21 EST,AMD,AMD,2.00,1,200.00,OPTION,95.00,call,BUY,2020-12-18,913254235.0,long,2020-12-14
324,3.9227875549986406e+17,12/14/2020 14:01:14 EST,JD,JD.com,80.09,10,800.90,STOCK,,,BUY,,913255864.0,long,2020-12-14
325,3.9227508673798144e+17,12/14/2020 13:51:39 EST,RKT,Rocket Companies,2.35,2,470.00,OPTION,20.00,call,SELL,2020-12-18,950168855.0,short,2020-12-14
326,3.92273808481919e+17,12/14/2020 13:41:35 EST,RVLV,Revolve Group,0.20,1,20.00,OPTION,26.50,call,SELL,2020-12-18,950090181.0,short,2020-12-14
327,3.922701532885156e+17,12/14/2020 13:27:04 EST,RKT,Rocket Companies,2.40,2,480.00,OPTION,20.00,call,SELL,2020-12-18,950168855.0,short,2020-12-14
328,3.922684684995871e+17,12/14/2020 13:20:21 EST,RKT,Rocket Companies,2.21,2,442.00,OPTION,20.00,call,SELL,2020-12-18,950168855.0,short,2020-12-14
329,3.9223522915630694e+17,12/14/2020 11:08:17 EST,PLTR,Palantir Technologies Inc.,0.44,1,44.00,OPTION,25.00,put,SELL,2020-12-18,950172475.0,long,2020-12-14
330,3.922347370931036e+17,12/14/2020 11:06:19 EST,JD,JD.com,0.96,2,192.00,OPTION,83.00,call,BUY,2020-12-24,913255864.0,long,2020-12-14
331,3.922328575122309e+17,12/14/2020 10:58:51 EST,HYLN,Hyliion Holdings Corporation,0.10,1,10.00,OPTION,20.00,call,SELL,2020-12-18,950122538.0,short,2020-12-14
332,3.9223272056397414e+17,12/14/2020 10:58:51 EST,TDOC,TELADOC HEALTH,3.70,1,370.00,OPTION,200.00,call,SELL,2020-12-18,913254759.0,short,2020-12-14
333,3.922316799151964e+17,12/14/2020 10:54:10 EST,AMD,AMD,0.83,1,83.00,OPTION,95.00,call,SELL,2020-12-18,913254235.0,short,2020-12-14
334,3.922316113719296e+17,12/14/2020 10:53:54 EST,PLTR,Palantir Technologies Inc.,0.72,2,144.00,OPTION,29.00,call,SELL,2020-12-18,950172475.0,short,2020-12-14
335,3.9223153730473984e+17,12/14/2020 10:53:36 EST,LMND,"Lemonade, Inc.",3.22,1,322.00,OPTION,95.00,call,SELL,2020-12-18,950166007.0,short,2020-12-14
336,3.922292961580933e+17,12/14/2020 10:44:42 EST,LMND,"Lemonade, Inc.",91.72,50,4586.00,STOCK,,,BUY,,950166007.0,long,2020-12-14
337,3.9222516921040896e+17,12/14/2020 12:55:17 EST,NIO,NIO Inc.,1.04,1,104.00,OPTION,36.00,put,SELL,2020-12-24,950076017.0,long,2020-12-14
338,3.922214765409239e+17,12/14/2020 10:13:38 EST,LMND,"Lemonade, Inc.",93.15,50,4657.73,STOCK,,,SELL,,950166007.0,short,2020-12-14
339,3.922213379946578e+17,12/14/2020 10:13:47 EST,JD,JD.com,1.20,2,240.00,OPTION,83.00,call,BUY,2020-12-24,913255864.0,long,2020-12-14
340,3.9221948685961216e+17,12/14/2020 10:05:43 EST,RVLV,Revolve Group,25.07,100,2507.00,STOCK,,,SELL,,950090181.0,short,2020-12-14
341,3.922187932937011e+17,12/14/2020 10:03:20 EST,RKT,Rocket Companies,1.70,5,850.00,OPTION,20.00,call,SELL,2020-12-18,950168855.0,short,2020-12-14
342,3.911723009735844e+17,12/11/2020 12:44:35 EST,LMND,"Lemonade, Inc.",89.69,50,4484.50,STOCK,,,BUY,,950166007.0,long,2020-12-11
343,3.91171678568235e+17,12/11/2020 12:42:06 EST,RKT,Rocket Companies,0.01,4,4.00,OPTION,21.50,call,SELL,2020-12-11,950168855.0,short,2020-12-11
344,3.9117123654733824e+17,12/11/2020 12:40:21 EST,TDOC,TELADOC HEALTH,0.05,1,5.00,OPTION,200.00,call,SELL,2020-12-11,913254759.0,short,2020-12-11
345,3.911701658379551e+17,12/11/2020 12:36:06 EST,LMND,"Lemonade, Inc.",88.29,50,4414.50,STOCK,,,BUY,,950166007.0,long,2020-12-11
346,3.91170037169279e+17,12/11/2020 12:35:52 EST,TDOC,TELADOC HEALTH,2.30,2,460.00,OPTION,205.00,call,SELL,2020-12-18,913254759.0,short,2020-12-11
347,3.91126230973313e+17,12/11/2020 09:41:31 EST,PLTR,Palantir Technologies Inc.,0.18,1,18.00,OPTION,29.00,call,SELL,2020-12-11,950172475.0,short,2020-12-11
348,3.911241915181302e+17,12/11/2020 09:33:25 EST,AMD,AMD,0.95,3,285.00,OPTION,95.00,call,SELL,2020-12-18,913254235.0,short,2020-12-11
349,3.911237074787492e+17,12/11/2020 09:31:34 EST,NIO,NIO Inc.,42.97,50,2148.50,STOCK,,,BUY,,950076017.0,long,2020-12-11
350,3.91123575131648e+17,12/11/2020 09:30:58 EST,TDOC,TELADOC HEALTH,1.50,1,150.00,OPTION,200.00,call,BUY,2020-12-11,913254759.0,long,2020-12-11
351,3.90467932133548e+17,12/09/2020 14:05:40 EST,PLTR,Palantir Technologies Inc.,25.86,100,2585.89,STOCK,,,BUY,,950172475.0,long,2020-12-09
352,3.904591969167073e+17,12/09/2020 13:30:58 EST,AMD,AMD,0.67,1,67.00,OPTION,93.00,call,SELL,2020-12-11,913254235.0,short,2020-12-09
353,3.904591225265234e+17,12/09/2020 13:30:40 EST,TDOC,TELADOC HEALTH,0.47,1,47.00,OPTION,200.00,call,SELL,2020-12-11,913254759.0,short,2020-12-09
354,3.904587810179154e+17,12/09/2020 13:29:19 EST,PLTR,Palantir Technologies Inc.,0.34,1,34.00,OPTION,29.00,call,SELL,2020-12-11,950172475.0,short,2020-12-09
355,3.9013195291878605e+17,12/08/2020 15:50:37 EST,PLTR,Palantir Technologies Inc.,0.45,1,45.00,OPTION,26.00,put,SELL,2020-12-11,950172475.0,long,2020-12-08
356,3.897331695758008e+17,12/07/2020 13:25:59 EST,RVLV,Revolve Group,24.58,100,2458.00,STOCK,,,BUY,,950090181.0,long,2020-12-07
357,3.897313719264461e+17,12/07/2020 13:18:50 EST,RUN,Sunrun,58.54,100,5854.00,STOCK,,,BUY,,913256036.0,long,2020-12-07
358,3.897288877618258e+17,12/07/2020 13:18:51 EST,RVLV,Revolve Group,1.20,1,120.00,OPTION,24.00,call,BUY,2020-12-11,950090181.0,long,2020-12-07
359,3.89698654337835e+17,12/07/2020 11:08:50 EST,NIO,NIO Inc.,45.09,50,2254.50,STOCK,,,SHORT,,950076017.0,short,2020-12-07
360,3.896018389759672e+17,12/07/2020 04:44:07 EST,RKT,Rocket Companies,19.85,1,19.85,STOCK,,,BUY,,950168855.0,long,2020-12-07
361,122241558.0,12/04/2020 15:29:17 EST,RKT,Rocket Companies,0.80,5,400.00,OPTION,20.00,call,BUY,2020-12-18,950168855.0,long,2020-12-04
362,122196636.0,12/04/2020 14:38:28 EST,RVLV,Revolve Group,0.30,1,30.00,OPTION,24.00,call,SELL,2020-12-11,950090181.0,short,2020-12-04
363,122195265.0,12/04/2020 14:38:11 EST,RVLV,Revolve Group,0.30,1,30.00,OPTION,22.50,call,BUY,2020-12-04,950090181.0,long,2020-12-04
364,122194825.0,12/04/2020 14:36:30 EST,RKT,Rocket Companies,0.87,4,348.00,OPTION,20.00,call,BUY,2020-12-18,950168855.0,long,2020-12-04
365,122127878.0,12/04/2020 13:33:42 EST,RKT,Rocket Companies,0.02,1,2.00,OPTION,20.50,call,SELL,2020-12-04,950168855.0,short,2020-12-04
366,122039901.0,12/04/2020 12:25:35 EST,AMD,AMD,3.00,2,600.00,OPTION,95.00,call,SELL,2020-12-18,913254235.0,short,2020-12-04
367,121992327.0,12/04/2020 11:47:54 EST,DOYU,DOUYU,0.05,16,80.00,OPTION,15.00,call,SELL,2020-12-18,950122558.0,short,2020-12-04
368,121930477.0,12/04/2020 11:08:27 EST,AMD,AMD,2.80,2,560.00,OPTION,95.00,call,SELL,2020-12-18,913254235.0,short,2020-12-04
369,121381538.0,12/03/2020 15:22:17 EST,IIPR,Innovative Indl,151.32,10,1513.20,STOCK,,,BUY,,925174192.0,long,2020-12-03
370,121291389.0,12/03/2020 13:54:59 EST,TDOC,TELADOC HEALTH,5.50,2,1100.00,OPTION,205.00,call,BUY,2020-12-18,913254759.0,long,2020-12-03
371,121128612.0,12/03/2020 11:29:48 EST,AMD,AMD,0.04,1,4.00,OPTION,100.00,call,SELL,2020-12-04,913254235.0,short,2020-12-03
372,121120274.0,12/03/2020 11:32:12 EST,RVLV,Revolve Group,0.20,1,20.00,OPTION,22.50,call,SELL,2020-12-04,950090181.0,short,2020-12-03
373,120991223.0,12/03/2020 10:17:11 EST,RKT,Rocket Companies,0.05,2,10.00,OPTION,21.00,call,SELL,2020-12-04,950168855.0,short,2020-12-03
374,120982679.0,12/03/2020 10:13:52 EST,RVLV,Revolve Group,22.63,100,2263.00,STOCK,,,BUY,,950090181.0,long,2020-12-03
375,120554642.0,12/02/2020 15:04:32 EST,PLTR,Palantir Technologies Inc.,0.44,1,44.00,OPTION,25.00,call,SELL,2020-12-04,950172475.0,short,2020-12-02
376,120545524.0,12/02/2020 14:57:04 EST,PLTR,Palantir Technologies Inc.,22.40,50,1120.00,STOCK,,,BUY,,950172475.0,long,2020-12-02
377,120539982.0,12/02/2020 15:01:32 EST,TDOC,TELADOC HEALTH,5.00,2,1000.00,OPTION,205.00,call,SELL,2020-12-18,913254759.0,short,2020-12-02
378,120539234.0,12/02/2020 14:48:19 EST,PLTR,Palantir Technologies Inc.,22.58,50,1129.00,STOCK,,,BUY,,950172475.0,long,2020-12-02
379,120311221.0,12/02/2020 11:26:35 EST,UVXY,ProShares Ultra VIX Short-Term Futures,0.35,1,35.00,OPTION,11.00,call,SELL,2020-12-04,913424717.0,short,2020-12-02
380,120264810.0,12/02/2020 10:58:54 EST,NIO,NIO Inc.,44.59,50,2229.50,STOCK,,,BUY,,950076017.0,long,2020-12-02
381,120237415.0,12/02/2020 10:44:07 EST,NIO,NIO Inc.,44.96,50,2248.08,STOCK,,,SHORT,,950076017.0,short,2020-12-02
382,120216009.0,12/02/2020 10:33:44 EST,PLTR,Palantir Technologies Inc.,0.52,1,52.00,OPTION,21.00,put,SELL,2020-12-04,950172475.0,long,2020-12-02
383,120158886.0,12/02/2020 10:11:19 EST,NIO,NIO Inc.,0.95,1,95.00,OPTION,40.00,put,SELL,2020-12-04,950076017.0,long,2020-12-02
384,120094355.0,12/02/2020 09:51:31 EST,NIO,NIO Inc.,0.43,1,43.00,OPTION,35.00,put,SELL,2020-12-04,950076017.0,long,2020-12-02
385,119651688.0,12/01/2020 14:55:30 EST,GS,Goldman Sachs,2.91,1,291.00,OPTION,240.00,call,SELL,2020-12-18,913255353.0,short,2020-12-01
386,119604037.0,12/01/2020 14:09:46 EST,UVXY,ProShares Ultra VIX Short-Term Futures,11.14,100,1113.96,STOCK,,,BUY,,913424717.0,long,2020-12-01
387,119599607.0,12/01/2020 14:14:07 EST,TDOC,TELADOC HEALTH,4.90,1,490.00,OPTION,205.00,call,BUY,2020-12-18,913254759.0,long,2020-12-01
388,119375418.0,12/01/2020 11:28:27 EST,RKT,Rocket Companies,1.30,1,130.00,OPTION,20.00,call,BUY,2020-12-18,950168855.0,long,2020-12-01
389,119154743.0,12/01/2020 10:49:07 EST,RVLV,Revolve Group,0.50,1,50.00,OPTION,23.50,call,SELL,2020-12-04,950090181.0,short,2020-12-01
390,119107028.0,12/01/2020 09:46:24 EST,DOYU,DOUYU,12.96,300,3888.00,STOCK,,,SELL,,950122558.0,short,2020-12-01
391,119049324.0,12/01/2020 09:35:02 EST,AMD,AMD,2.76,1,276.00,OPTION,95.00,call,BUY,2020-12-18,913254235.0,long,2020-12-01
392,119038581.0,12/01/2020 09:33:01 EST,AMD,AMD,2.88,2,576.00,OPTION,95.00,call,BUY,2020-12-18,913254235.0,long,2020-12-01
393,118656565.0,11/30/2020 14:41:11 EST,TDOC,TELADOC HEALTH,6.50,1,650.00,OPTION,205.00,call,BUY,2020-12-18,913254759.0,long,2020-11-30
394,118589561.0,11/30/2020 13:40:14 EST,AMD,AMD,3.40,2,680.00,OPTION,95.00,call,SELL,2020-12-18,913254235.0,short,2020-11-30
395,118585845.0,11/30/2020 13:39:29 EST,GS,Goldman Sachs,2.30,1,230.00,OPTION,240.00,call,BUY,2020-12-18,913255353.0,long,2020-11-30
396,118433568.0,11/30/2020 11:54:50 EST,AMD,AMD,2.62,2,524.00,OPTION,95.00,call,SELL,2020-12-18,913254235.0,short,2020-11-30
397,118427940.0,11/30/2020 11:51:06 EST,AMD,AMD,2.71,2,542.00,OPTION,95.00,call,SELL,2020-12-18,913254235.0,short,2020-11-30
398,118307866.0,11/30/2020 10:45:46 EST,AMD,AMD,1.12,1,112.00,OPTION,95.00,call,BUY,2020-12-18,913254235.0,long,2020-11-30
399,118292330.0,11/30/2020 10:41:30 EST,PLTR,Palantir Technologies Inc.,0.25,1,25.00,OPTION,20.00,put,SELL,2020-12-04,950172475.0,long,2020-11-30
400,118264362.0,11/30/2020 10:32:47 EST,IIPR,Innovative Indl,153.45,10,1534.50,STOCK,,,BUY,,925174192.0,long,2020-11-30
401,118258561.0,11/30/2020 10:31:03 EST,TDOC,TELADOC HEALTH,1.00,1,100.00,OPTION,207.50,call,SELL,2020-12-04,913254759.0,short,2020-11-30
402,118223737.0,11/30/2020 10:19:19 EST,SLV,iShares Silver Trust,20.82,100,2082.00,STOCK,,,SELL,,913244503.0,short,2020-11-30
403,118211487.0,11/30/2020 10:18:19 EST,HYLN,Hyliion Holdings Corporation,0.50,2,100.00,OPTION,22.50,call,SELL,2020-12-04,950122538.0,short,2020-11-30
404,118136565.0,11/30/2020 09:53:47 EST,RKT,Rocket Companies,1.15,5,575.00,OPTION,20.00,call,BUY,2020-12-18,950168855.0,long,2020-11-30
405,118018490.0,11/30/2020 09:39:47 EST,HYLN,Hyliion Holdings Corporation,21.00,100,2100.00,STOCK,,,BUY,,950122538.0,long,2020-11-30
406,117600109.0,11/27/2020 11:52:52 EST,MRNA,Moderna,127.08,10,1270.80,STOCK,,,SELL,,950102542.0,short,2020-11-27
407,117594112.0,11/27/2020 11:49:15 EST,AMD,AMD,1.22,1,122.00,OPTION,95.00,call,BUY,2020-12-18,913254235.0,long,2020-11-27
408,117561677.0,11/27/2020 11:29:02 EST,TSLA,TESLA,589.43,5,2947.15,STOCK,,,SELL,,913255598.0,short,2020-11-27
409,117557960.0,11/27/2020 11:26:48 EST,MRNA,Moderna,124.37,10,1243.70,STOCK,,,BUY,,950102542.0,long,2020-11-27
410,117475224.0,11/27/2020 10:38:16 EST,MRNA,Moderna,3.00,1,300.00,OPTION,127.00,call,SELL,2020-11-27,950102542.0,short,2020-11-27
411,117473245.0,11/27/2020 10:37:19 EST,MRNA,Moderna,17.73,1,1773.00,OPTION,110.00,call,BUY,2020-11-27,950102542.0,long,2020-11-27
412,117463935.0,11/27/2020 10:33:00 EST,TDOC,TELADOC HEALTH,0.10,1,10.00,OPTION,200.00,call,SELL,2020-11-27,913254759.0,short,2020-11-27
413,117462926.0,11/27/2020 10:32:33 EST,RVLV,Revolve Group,0.11,2,22.00,OPTION,23.00,call,SELL,2020-11-27,950090181.0,short,2020-11-27
414,117444405.0,11/27/2020 10:24:17 EST,AMD,AMD,1.41,3,423.00,OPTION,95.00,call,BUY,2020-12-18,913254235.0,long,2020-11-27
415,117378357.0,11/27/2020 10:01:02 EST,JD,JD.com,2.35,3,705.00,OPTION,90.00,call,SELL,2020-12-11,913255864.0,short,2020-11-27
416,117365543.0,11/27/2020 09:57:19 EST,RVLV,Revolve Group,0.45,1,45.00,OPTION,22.50,call,BUY,2020-11-27,950090181.0,long,2020-11-27
417,117344388.0,11/27/2020 09:51:14 EST,AMD,AMD,0.13,1,13.00,OPTION,88.50,call,SELL,2020-11-27,913254235.0,short,2020-11-27
418,117339731.0,11/27/2020 09:49:38 EST,AMD,AMD,1.54,5,770.00,OPTION,95.00,call,BUY,2020-12-18,913254235.0,long,2020-11-27
419,117335865.0,11/27/2020 09:48:31 EST,AMD,AMD,87.72,100,8772.00,STOCK,,,BUY,,913254235.0,long,2020-11-27
420,117287762.0,11/27/2020 09:36:45 EST,TDOC,TELADOC HEALTH,2.00,1,200.00,OPTION,192.50,call,BUY,2020-11-27,913254759.0,long,2020-11-27
421,116954774.0,11/25/2020 14:55:03 EST,JD,JD.com,2.14,3,642.00,OPTION,90.00,call,BUY,2020-12-11,913255864.0,long,2020-11-25
422,116876514.0,11/25/2020 13:39:53 EST,DOYU,DOUYU,0.40,6,240.00,OPTION,15.00,call,BUY,2020-12-18,950122558.0,long,2020-11-25
423,116844559.0,11/25/2020 13:13:08 EST,SBE,Switchback Energy Acquisition Corp,35.78,100,3578.26,STOCK,,,BUY,,950139945.0,long,2020-11-25
424,116844371.0,11/25/2020 13:12:58 EST,SBE,Switchback Energy Acquisition Corp,0.70,1,70.00,OPTION,22.50,put,BUY,2020-12-18,950139945.0,short,2020-11-25
425,116769987.0,11/25/2020 12:20:21 EST,RVLV,Revolve Group,1.20,1,120.00,OPTION,21.50,call,BUY,2020-11-27,950090181.0,long,2020-11-25
426,116693714.0,11/25/2020 11:21:31 EST,HYLN,Hyliion Holdings Corporation,0.30,1,30.00,OPTION,25.50,call,SELL,2020-11-27,950122538.0,short,2020-11-25
427,116666166.0,11/25/2020 11:03:58 EST,SLV,iShares Silver Trust,0.09,1,9.00,OPTION,22.00,call,SELL,2020-11-27,913244503.0,short,2020-11-25
428,116647458.0,11/25/2020 10:53:32 EST,TSLA,TESLA,553.24,5,2766.20,STOCK,,,BUY,,913255598.0,long,2020-11-25
429,116646933.0,11/25/2020 10:54:15 EST,HYLN,Hyliion Holdings Corporation,24.90,100,2490.00,STOCK,,,BUY,,950122538.0,long,2020-11-25
430,116600765.0,11/25/2020 10:29:30 EST,XPEV,XPENG INC.,0.94,1,94.00,OPTION,60.00,put,BUY,2020-11-27,950171618.0,short,2020-11-25
431,116600246.0,11/25/2020 10:29:15 EST,XPEV,XPENG INC.,64.54,100,6454.00,STOCK,,,BUY,,950171618.0,long,2020-11-25
432,116565995.0,11/25/2020 13:43:32 EST,RVLV,Revolve Group,0.95,1,95.00,OPTION,21.50,call,BUY,2020-11-27,950090181.0,long,2020-11-25
433,116564513.0,11/25/2020 10:13:49 EST,MRNA,Moderna,0.69,1,69.00,OPTION,110.00,call,SELL,2020-11-27,950102542.0,short,2020-11-25
434,116563349.0,11/25/2020 10:14:36 EST,MRNA,Moderna,5.40,1,540.00,OPTION,110.00,call,SELL,2020-12-18,950102542.0,short,2020-11-25
435,116018034.0,11/24/2020 13:58:32 EST,XPEV,XPENG INC.,1.24,1,124.00,OPTION,60.00,put,SELL,2020-11-27,950171618.0,long,2020-11-24
436,116005722.0,11/24/2020 13:49:02 EST,SBE,Switchback Energy Acquisition Corp,0.75,1,75.00,OPTION,22.50,put,SELL,2020-12-18,950139945.0,long,2020-11-24
437,116003884.0,11/24/2020 13:47:43 EST,SBE,Switchback Energy Acquisition Corp,37.52,50,1876.00,STOCK,,,SHORT,,950139945.0,short,2020-11-24
438,116001787.0,11/24/2020 14:49:07 EST,XPEV,XPENG INC.,68.50,50,3425.00,STOCK,,,SHORT,,950171618.0,short,2020-11-24
439,115990202.0,11/24/2020 13:36:49 EST,RKT,Rocket Companies,0.40,2,80.00,OPTION,21.00,put,SELL,2020-11-27,950168855.0,long,2020-11-24
440,115980284.0,11/24/2020 13:28:17 EST,XPEV,XPENG INC.,67.84,50,3392.00,STOCK,,,SHORT,,950171618.0,short,2020-11-24
441,115979098.0,11/24/2020 13:27:13 EST,SBE,Switchback Energy Acquisition Corp,39.22,50,1961.00,STOCK,,,SHORT,,950139945.0,short,2020-11-24
442,115965829.0,11/24/2020 13:15:17 EST,RKT,Rocket Companies,0.38,2,76.00,OPTION,21.00,put,SELL,2020-11-27,950168855.0,long,2020-11-24
443,115952768.0,11/24/2020 13:03:36 EST,XPEV,XPENG INC.,68.85,150,10327.50,STOCK,,,BUY,,950171618.0,long,2020-11-24
444,115804691.0,11/24/2020 11:21:12 EST,XPEV,XPENG INC.,73.06,100,7305.77,STOCK,,,SHORT,,950171618.0,short,2020-11-24
445,115781233.0,11/24/2020 11:08:12 EST,XPEV,XPENG INC.,70.01,50,3500.50,STOCK,,,SHORT,,950171618.0,short,2020-11-24
446,115747420.0,11/24/2020 12:57:59 EST,RVLV,Revolve Group,0.25,2,50.00,OPTION,22.50,call,SELL,2020-11-27,950090181.0,short,2020-11-24
447,115745781.0,11/24/2020 10:51:03 EST,TDOC,TELADOC HEALTH,2.56,8,2048.00,OPTION,200.00,call,SELL,2020-12-04,913254759.0,short,2020-11-24
448,115678346.0,11/24/2020 10:23:13 EST,TDOC,TELADOC HEALTH,1.70,1,170.00,OPTION,192.50,call,SELL,2020-11-27,913254759.0,short,2020-11-24
449,115638204.0,11/24/2020 10:09:40 EST,MRNA,Moderna,3.10,1,310.00,OPTION,110.00,call,BUY,2020-12-18,950102542.0,long,2020-11-24
450,115606658.0,11/24/2020 10:00:53 EST,TDOC,TELADOC HEALTH,3.00,3,900.00,OPTION,200.00,call,BUY,2020-12-04,913254759.0,long,2020-11-24
451,115390284.0,11/24/2020 08:55:41 EST,SLV,iShares Silver Trust,21.59,100,2159.00,STOCK,,,BUY,,913244503.0,long,2020-11-24
452,115106974.0,11/23/2020 15:59:01 EST,TDOC,TELADOC HEALTH,4.60,1,460.00,OPTION,200.00,call,BUY,2020-12-04,913254759.0,long,2020-11-23
453,115064328.0,11/23/2020 15:29:45 EST,MRNA,Moderna,2.60,1,260.00,OPTION,100.00,call,BUY,2020-11-27,950102542.0,long,2020-11-23
454,114964900.0,11/23/2020 14:01:32 EST,RVLV,Revolve Group,0.20,2,40.00,OPTION,21.50,call,SELL,2020-11-27,950090181.0,short,2020-11-23
455,114954595.0,11/23/2020 13:52:20 EST,RVLV,Revolve Group,1.29,5,644.00,OPTION,20.00,call,SELL,2020-12-04,950090181.0,short,2020-11-23
456,114775013.0,11/23/2020 11:40:33 EST,TDOC,TELADOC HEALTH,4.80,1,480.00,OPTION,200.00,call,BUY,2020-12-04,913254759.0,long,2020-11-23
457,114772457.0,11/23/2020 11:37:55 EST,RVLV,Revolve Group,0.95,2,190.00,OPTION,20.00,call,SELL,2020-12-04,950090181.0,short,2020-11-23
458,114712718.0,11/23/2020 11:03:59 EST,MRNA,Moderna,1.90,1,190.00,OPTION,100.00,call,SELL,2020-11-27,950102542.0,short,2020-11-23
459,114712367.0,11/23/2020 11:03:48 EST,MRNA,Moderna,99.33,50,4966.44,STOCK,,,BUY,,950102542.0,long,2020-11-23
460,114638824.0,11/23/2020 10:29:18 EST,TDOC,TELADOC HEALTH,5.00,1,500.00,OPTION,200.00,call,BUY,2020-12-04,913254759.0,long,2020-11-23
461,114619566.0,11/23/2020 10:22:05 EST,MRNA,Moderna,99.97,50,4998.50,STOCK,,,SELL,,950102542.0,short,2020-11-23
462,114598533.0,11/23/2020 10:15:52 EST,LUV,Southwest,45.91,100,4591.00,STOCK,,,SELL,,913255501.0,short,2020-11-23
463,114596731.0,11/23/2020 10:14:08 EST,TQQQ,ProShares UltraPro QQQ,144.40,10,1444.00,STOCK,,,SELL,,913732468.0,short,2020-11-23
464,114585909.0,11/23/2020 10:10:46 EST,RUN,Sunrun,62.60,100,6260.00,STOCK,,,SELL,,913256036.0,short,2020-11-23
465,114526155.0,11/23/2020 09:53:20 EST,NIO,NIO Inc.,50.90,50,2545.00,STOCK,,,BUY,,950076017.0,long,2020-11-23
466,114524960.0,11/23/2020 09:55:43 EST,DOYU,DOUYU,0.40,10,400.00,OPTION,15.00,call,BUY,2020-12-18,950122558.0,long,2020-11-23
467,114516044.0,11/23/2020 09:50:33 EST,INTC,Intel,0.11,1,11.00,OPTION,47.00,call,SELL,2020-11-27,913257268.0,short,2020-11-23
468,114503340.0,11/23/2020 09:47:41 EST,TDOC,TELADOC HEALTH,5.60,2,1120.00,OPTION,200.00,call,BUY,2020-12-04,913254759.0,long,2020-11-23
469,114114760.0,11/20/2020 15:10:23 EST,JD,JD.com,1.01,5,504.00,OPTION,90.00,call,SELL,2020-11-27,913255864.0,short,2020-11-20
470,114063528.0,11/20/2020 14:13:20 EST,JD,JD.com,0.89,5,445.00,OPTION,90.00,call,BUY,2020-11-27,913255864.0,long,2020-11-20
471,114052338.0,11/20/2020 14:00:53 EST,W,Wayfair,8.70,2,1740.00,OPTION,310.00,call,SELL,2021-01-15,913254679.0,short,2020-11-20
472,114040782.0,11/20/2020 13:48:39 EST,TDOC,TELADOC HEALTH,0.25,1,25.00,OPTION,202.50,call,SELL,2020-11-20,913254759.0,short,2020-11-20
473,114039267.0,11/20/2020 13:47:08 EST,TDOC,TELADOC HEALTH,1.20,1,120.00,OPTION,200.00,call,BUY,2020-11-20,913254759.0,long,2020-11-20
474,114038088.0,11/20/2020 13:57:14 EST,IIPR,Innovative Indl,151.55,10,1515.50,STOCK,,,BUY,,925174192.0,long,2020-11-20
475,113993123.0,11/20/2020 13:01:40 EST,TDOC,TELADOC HEALTH,0.48,1,48.00,OPTION,200.00,call,SELL,2020-11-20,913254759.0,short,2020-11-20
476,113947680.0,11/20/2020 12:22:53 EST,RUN,Sunrun,1.15,1,115.00,OPTION,60.00,call,BUY,2020-11-20,913256036.0,long,2020-11-20
477,113945161.0,11/20/2020 12:21:04 EST,TDOC,TELADOC HEALTH,1.47,1,147.00,OPTION,197.50,call,BUY,2020-11-20,913254759.0,long,2020-11-20
478,113900950.0,11/20/2020 11:50:14 EST,MRNA,Moderna,0.14,1,14.00,OPTION,100.00,call,SELL,2020-11-20,950102542.0,short,2020-11-20
479,113898709.0,11/20/2020 11:49:02 EST,TDOC,TELADOC HEALTH,0.50,1,50.00,OPTION,197.50,call,SELL,2020-11-20,913254759.0,short,2020-11-20
480,113724037.0,11/20/2020 10:16:16 EST,W,Wayfair,9.00,1,900.00,OPTION,310.00,call,SELL,2021-01-15,913254679.0,short,2020-11-20
481,113351448.0,11/19/2020 15:59:14 EST,NIO,NIO Inc.,48.51,50,2425.50,STOCK,,,SHORT,,950076017.0,short,2020-11-19
482,113333805.0,11/19/2020 15:44:22 EST,NIO,NIO Inc.,48.61,200,9721.68,STOCK,,,BUY,,950076017.0,long,2020-11-19
483,113315384.0,11/19/2020 15:26:38 EST,NIO,NIO Inc.,48.11,50,2405.50,STOCK,,,SHORT,,950076017.0,short,2020-11-19
484,113314815.0,11/19/2020 15:26:11 EST,NIO,NIO Inc.,0.58,1,58.00,OPTION,47.00,put,BUY,2020-11-20,950076017.0,short,2020-11-19
485,113279213.0,11/19/2020 14:49:26 EST,NIO,NIO Inc.,0.61,1,61.00,OPTION,47.00,put,SELL,2020-11-20,950076017.0,long,2020-11-19
486,113133703.0,11/19/2020 12:18:30 EST,TDOC,TELADOC HEALTH,2.60,1,260.00,OPTION,190.00,call,BUY,2020-11-20,913254759.0,long,2020-11-19
487,113098707.0,11/19/2020 11:51:30 EST,NIO,NIO Inc.,1.80,1,180.00,OPTION,44.00,put,BUY,2020-11-27,950076017.0,short,2020-11-19
488,113041349.0,11/19/2020 11:25:21 EST,RVLV,Revolve Group,0.15,4,60.00,OPTION,20.50,call,SELL,2020-11-20,950090181.0,short,2020-11-19
489,113011391.0,11/19/2020 10:53:34 EST,MRNA,Moderna,1.13,1,113.00,OPTION,100.00,call,SELL,2020-11-27,950102542.0,short,2020-11-19
490,112999002.0,11/19/2020 10:51:28 EST,MRNA,Moderna,1.12,1,112.00,OPTION,100.00,call,SELL,2020-11-27,950102542.0,short,2020-11-19
491,112950049.0,11/19/2020 10:23:27 EST,NIO,NIO Inc.,47.33,50,2366.50,STOCK,,,SHORT,,950076017.0,short,2020-11-19
492,112934238.0,11/19/2020 10:16:13 EST,NIO,NIO Inc.,0.61,1,61.00,OPTION,45.00,put,SELL,2020-11-20,950076017.0,long,2020-11-19
493,112918138.0,11/19/2020 10:09:59 EST,NIO,NIO Inc.,0.05,1,5.00,OPTION,37.00,put,BUY,2020-11-20,950076017.0,short,2020-11-19
494,112917436.0,11/19/2020 10:09:45 EST,DKNG,DraftKings Inc,0.10,1,10.00,OPTION,41.00,put,BUY,2020-11-20,950153166.0,short,2020-11-19
495,112916510.0,11/19/2020 10:09:24 EST,DKNG,DraftKings Inc,0.05,1,5.00,OPTION,43.00,put,BUY,2020-11-20,950153166.0,short,2020-11-19
496,112897669.0,11/19/2020 10:02:26 EST,JD,JD.com,85.49,30,2564.60,STOCK,,,BUY,,913255864.0,long,2020-11-19
497,112843237.0,11/19/2020 09:45:02 EST,NIO,NIO Inc.,2.08,1,208.00,OPTION,44.00,put,SELL,2020-11-27,950076017.0,long,2020-11-19
498,112785717.0,11/19/2020 09:35:43 EST,MRNA,Moderna,0.40,1,40.00,OPTION,95.00,call,BUY,2020-11-20,950102542.0,long,2020-11-19
499,112550896.0,11/18/2020 15:20:11 EST,RUN,Sunrun,0.51,1,51.00,OPTION,60.00,call,SELL,2020-11-20,913256036.0,short,2020-11-18
500,112520267.0,11/18/2020 14:49:38 EST,TDOC,TELADOC HEALTH,1.65,1,165.00,OPTION,190.00,call,SELL,2020-11-20,913254759.0,short,2020-11-18
501,112519303.0,11/18/2020 14:48:40 EST,TDOC,TELADOC HEALTH,3.40,1,340.00,OPTION,185.00,call,BUY,2020-11-20,913254759.0,long,2020-11-18
502,112419862.0,11/18/2020 13:13:08 EST,RUN,Sunrun,1.39,1,139.00,OPTION,60.00,call,BUY,2020-11-20,913256036.0,long,2020-11-18
503,112348801.0,11/18/2020 12:11:10 EST,DOYU,DOUYU,13.44,100,1344.00,STOCK,,,BUY,,950122558.0,long,2020-11-18
504,112331971.0,11/18/2020 12:00:15 EST,NIO,NIO Inc.,45.90,100,4590.00,STOCK,,,SHORT,,950076017.0,short,2020-11-18
505,112312713.0,11/18/2020 11:49:35 EST,TDOC,TELADOC HEALTH,1.00,1,100.00,OPTION,185.00,call,SELL,2020-11-20,913254759.0,short,2020-11-18
506,112298965.0,11/18/2020 11:36:48 EST,NIO,NIO Inc.,45.08,100,4508.00,STOCK,,,BUY,,950076017.0,long,2020-11-18
507,112269562.0,11/18/2020 11:15:30 EST,MRNA,Moderna,0.65,1,65.00,OPTION,95.00,call,SELL,2020-11-20,950102542.0,short,2020-11-18
508,112241126.0,11/18/2020 10:58:12 EST,T,AT&T,0.41,10,410.00,OPTION,30.00,call,SELL,2021-01-15,913324397.0,short,2020-11-18
509,112238884.0,11/18/2020 10:55:51 EST,DOYU,DOUYU,13.58,200,2715.68,STOCK,,,BUY,,950122558.0,long,2020-11-18
510,112238023.0,11/18/2020 10:55:20 EST,TME,Tencent Music,16.12,300,4836.00,STOCK,,,SELL,,950091606.0,short,2020-11-18
511,112170983.0,11/18/2020 10:21:09 EST,MRNA,Moderna,1.24,2,248.00,OPTION,100.00,call,BUY,2020-11-27,950102542.0,long,2020-11-18
512,112163497.0,11/18/2020 10:18:05 EST,MRNA,Moderna,2.20,1,220.00,OPTION,90.00,call,SELL,2020-11-20,950102542.0,short,2020-11-18
513,112160372.0,11/18/2020 10:16:40 EST,MRNA,Moderna,2.20,1,220.00,OPTION,90.00,call,SELL,2020-11-20,950102542.0,short,2020-11-18
514,112146533.0,11/18/2020 10:10:57 EST,MRNA,Moderna,1.80,1,180.00,OPTION,90.00,call,BUY,2020-11-20,950102542.0,long,2020-11-18
515,112128974.0,11/18/2020 10:04:04 EST,MRNA,Moderna,2.00,1,200.00,OPTION,90.00,call,BUY,2020-11-20,950102542.0,long,2020-11-18
516,111820262.0,11/17/2020 16:07:40 EST,NIO,NIO Inc.,43.90,50,2195.00,STOCK,,,BUY,,950076017.0,long,2020-11-17
517,111758734.0,11/17/2020 15:06:20 EST,NIO,NIO Inc.,0.81,1,81.00,OPTION,38.00,put,SELL,2020-11-20,950076017.0,long,2020-11-17
518,111757604.0,11/17/2020 15:05:20 EST,NIO,NIO Inc.,47.55,50,2377.50,STOCK,,,SHORT,,950076017.0,short,2020-11-17
519,111648810.0,11/17/2020 13:01:44 EST,TQQQ,ProShares UltraPro QQQ,148.66,10,1486.60,STOCK,,,BUY,,913732468.0,long,2020-11-17
520,111641402.0,11/17/2020 12:54:08 EST,HYLN,Hyliion Holdings Corporation,25.25,100,2525.00,STOCK,,,SELL,,950122538.0,short,2020-11-17
521,111442692.0,11/17/2020 10:22:46 EST,T,AT&T,0.39,10,390.00,OPTION,30.00,call,BUY,2021-01-15,913324397.0,long,2020-11-17
522,110821099.0,11/16/2020 11:25:13 EST,JWN,Nordstrom,0.05,1,5.00,OPTION,15.00,put,BUY,2020-11-20,913255449.0,short,2020-11-16
523,110816941.0,11/16/2020 11:22:21 EST,TDOC,TELADOC HEALTH,2.10,1,210.00,OPTION,185.00,call,BUY,2020-11-20,913254759.0,long,2020-11-16
524,110762195.0,11/16/2020 10:43:51 EST,TDOC,TELADOC HEALTH,2.18,1,218.00,OPTION,185.00,call,SELL,2020-11-20,913254759.0,short,2020-11-16
525,110749970.0,11/16/2020 10:36:32 EST,NIO,NIO Inc.,44.77,50,2238.50,STOCK,,,SHORT,,950076017.0,short,2020-11-16
526,110731372.0,11/16/2020 10:25:56 EST,INTC,Intel,0.37,1,37.00,OPTION,47.00,call,SELL,2020-11-20,913257268.0,short,2020-11-16
527,110710477.0,11/16/2020 10:33:58 EST,TDOC,TELADOC HEALTH,178.77,25,4469.25,STOCK,,,BUY,,913254759.0,long,2020-11-16
528,110685791.0,11/16/2020 10:04:54 EST,NIO,NIO Inc.,1.30,1,130.00,OPTION,37.00,put,SELL,2020-11-20,950076017.0,long,2020-11-16
529,110653294.0,11/16/2020 09:52:38 EST,DKNG,DraftKings Inc,1.60,1,160.00,OPTION,41.00,put,SELL,2020-11-20,950153166.0,long,2020-11-16
530,110636236.0,11/16/2020 09:47:04 EST,NIO,NIO Inc.,43.92,50,2196.00,STOCK,,,SHORT,,950076017.0,short,2020-11-16
531,110596050.0,11/16/2020 09:36:36 EST,BABA,Alibaba,258.00,10,2580.00,STOCK,,,BUY,,913254558.0,long,2020-11-16
532,110216775.0,11/13/2020 13:33:30 EST,U,Unity Software Inc.,114.18,10,1141.75,STOCK,,,SELL,,950172451.0,short,2020-11-13
533,110209050.0,11/13/2020 13:33:31 EST,DKNG,DraftKings Inc,1.60,1,160.00,OPTION,43.00,put,SELL,2020-11-20,950153166.0,long,2020-11-13
534,110084561.0,11/13/2020 11:20:21 EST,LUV,Southwest,0.34,1,34.00,OPTION,46.00,call,SELL,2020-11-20,913255501.0,short,2020-11-13
535,110070337.0,11/13/2020 11:10:33 EST,TDOC,TELADOC HEALTH,181.57,5,907.85,STOCK,,,BUY,,913254759.0,long,2020-11-13
536,110064536.0,11/13/2020 11:07:10 EST,LUV,Southwest,0.23,1,23.00,OPTION,43.50,call,BUY,2020-11-13,913255501.0,long,2020-11-13
537,109934867.0,11/13/2020 10:05:58 EST,HYLN,Hyliion Holdings Corporation,0.40,1,40.00,OPTION,23.50,call,BUY,2020-11-13,950122538.0,long,2020-11-13
538,109932836.0,11/13/2020 10:07:19 EST,MRNA,Moderna,1.25,1,125.00,OPTION,90.00,call,BUY,2020-11-13,950102542.0,long,2020-11-13
539,109577940.0,11/12/2020 15:03:38 EST,U,Unity Software Inc.,100.00,10,1000.00,STOCK,,,BUY,,950172451.0,long,2020-11-12
540,109330631.0,11/12/2020 11:00:08 EST,RUN,Sunrun,1.00,1,100.00,OPTION,60.00,call,SELL,2020-11-20,913256036.0,short,2020-11-12
541,109330080.0,11/12/2020 10:59:33 EST,RUN,Sunrun,55.21,50,2760.50,STOCK,,,BUY,,913256036.0,long,2020-11-12
542,109310733.0,11/12/2020 10:45:57 EST,MRNA,Moderna,1.25,1,125.00,OPTION,90.00,call,SELL,2020-11-13,950102542.0,short,2020-11-12
543,109299357.0,11/12/2020 10:38:54 EST,HYLN,Hyliion Holdings Corporation,0.51,1,51.00,OPTION,23.50,call,SELL,2020-11-13,950122538.0,short,2020-11-12
544,109259404.0,11/12/2020 10:16:37 EST,RVLV,Revolve Group,0.30,4,120.00,OPTION,21.00,call,SELL,2020-11-13,950090181.0,short,2020-11-12
545,109251800.0,11/12/2020 10:45:29 EST,MRNA,Moderna,8.50,1,850.00,OPTION,78.00,call,BUY,2020-11-13,950102542.0,long,2020-11-12
546,109248926.0,11/12/2020 10:11:10 EST,HYLN,Hyliion Holdings Corporation,1.40,1,140.00,OPTION,20.00,put,SELL,2020-11-20,950122538.0,long,2020-11-12
547,109129924.0,11/12/2020 09:31:01 EST,RVLV,Revolve Group,19.30,50,965.00,STOCK,,,BUY,,950090181.0,long,2020-11-12
548,108968542.0,11/11/2020 16:04:08 EST,RVLV,Revolve Group,19.96,50,998.00,STOCK,,,BUY,,950090181.0,long,2020-11-11
549,108937614.0,11/11/2020 15:19:49 EST,LUV,Southwest,0.40,1,40.00,OPTION,43.50,call,SELL,2020-11-13,913255501.0,short,2020-11-11
550,108931156.0,11/11/2020 15:09:26 EST,LUV,Southwest,42.71,50,2135.50,STOCK,,,BUY,,913255501.0,long,2020-11-11
551,108912293.0,11/11/2020 14:41:19 EST,TQQQ,ProShares UltraPro QQQ,142.24,40,5689.60,STOCK,,,SELL,,913732468.0,short,2020-11-11
552,108876653.0,11/11/2020 13:46:18 EST,W,Wayfair,8.60,1,860.00,OPTION,310.00,call,SELL,2021-01-15,913254679.0,short,2020-11-11
553,108722957.0,11/11/2020 13:47:26 EST,LUV,Southwest,43.50,50,2175.00,STOCK,,,BUY,,913255501.0,long,2020-11-11
554,108671251.0,11/11/2020 10:01:40 EST,LUV,Southwest,44.22,50,2211.00,STOCK,,,SELL,,913255501.0,short,2020-11-11
555,108355357.0,11/10/2020 13:55:40 EST,JWN,Nordstrom,0.44,1,44.00,OPTION,15.00,put,SELL,2020-11-20,913255449.0,long,2020-11-10
556,108343897.0,11/10/2020 13:39:10 EST,TQQQ,ProShares UltraPro QQQ,134.87,20,2697.40,STOCK,,,BUY,,913732468.0,long,2020-11-10
557,108273012.0,11/10/2020 12:15:24 EST,BABA,Alibaba,271.23,5,1356.15,STOCK,,,BUY,,913254558.0,long,2020-11-10
558,108262727.0,11/10/2020 12:05:28 EST,TQQQ,ProShares UltraPro QQQ,137.33,20,2746.60,STOCK,,,BUY,,913732468.0,long,2020-11-10
559,108161484.0,11/10/2020 10:52:09 EST,LUV,Southwest,43.86,50,2193.00,STOCK,,,BUY,,913255501.0,long,2020-11-10
560,108159290.0,11/10/2020 10:52:33 EST,TME,Tencent Music,14.80,100,1480.00,STOCK,,,BUY,,950091606.0,long,2020-11-10
561,108158584.0,11/10/2020 13:29:26 EST,RVLV,Revolve Group,21.40,100,2140.00,STOCK,,,BUY,,950090181.0,long,2020-11-10
562,108156439.0,11/10/2020 10:49:52 EST,TDOC,TELADOC HEALTH,170.33,10,1703.30,STOCK,,,BUY,,913254759.0,long,2020-11-10
563,108149965.0,11/10/2020 10:46:48 EST,NIO,NIO Inc.,2.68,1,268.00,OPTION,40.00,put,BUY,2020-11-13,950076017.0,short,2020-11-10
564,107584056.0,11/09/2020 13:33:36 EST,DKNG,DraftKings Inc,1.53,1,153.00,OPTION,41.00,put,SELL,2020-11-13,950153166.0,long,2020-11-09
565,107560957.0,11/09/2020 13:15:33 EST,TDOC,TELADOC HEALTH,182.00,5,910.00,STOCK,,,BUY,,913254759.0,long,2020-11-09
566,107538900.0,11/09/2020 12:49:44 EST,LAKE,Lakeland Ind,19.70,200,3940.00,STOCK,,,SELL,,913323383.0,short,2020-11-09
567,107399137.0,11/09/2020 11:02:17 EST,MRNA,Moderna,2.08,1,208.00,OPTION,78.00,call,SELL,2020-11-13,950102542.0,short,2020-11-09
568,107398369.0,11/09/2020 11:01:48 EST,INTC,Intel,0.38,1,38.00,OPTION,47.50,call,SELL,2020-11-13,913257268.0,short,2020-11-09
569,107249558.0,11/09/2020 09:59:20 EST,W,Wayfair,8.00,2,1600.00,OPTION,310.00,call,BUY,2021-01-15,913254679.0,long,2020-11-09
570,107218713.0,11/09/2020 09:49:29 EST,TDOC,TELADOC HEALTH,178.04,10,1780.40,STOCK,,,BUY,,913254759.0,long,2020-11-09
571,107144579.0,11/09/2020 09:30:01 EST,TDOC,TELADOC HEALTH,187.55,5,937.75,STOCK,,,BUY,,913254759.0,long,2020-11-09
572,106838372.0,11/06/2020 15:55:39 EST,RUN,Sunrun,57.76,50,2888.00,STOCK,,,BUY,,913256036.0,long,2020-11-06
573,106832401.0,11/06/2020 15:39:03 EST,TDOC,TELADOC HEALTH,205.88,5,1029.40,STOCK,,,BUY,,913254759.0,long,2020-11-06
574,106823096.0,11/06/2020 15:27:41 EST,RVLV,Revolve Group,19.01,200,3802.00,STOCK,,,BUY,,950090181.0,long,2020-11-06
575,106762218.0,11/06/2020 13:56:22 EST,W,Wayfair,27.00,1,2700.00,OPTION,310.00,call,BUY,2021-01-15,913254679.0,long,2020-11-06
576,106758023.0,11/06/2020 13:50:12 EST,LAKE,Lakeland Ind,22.99,100,2299.00,STOCK,,,BUY,,913323383.0,long,2020-11-06
577,106643920.0,11/06/2020 11:38:36 EST,W,Wayfair,30.00,1,3000.00,OPTION,310.00,call,BUY,2021-01-15,913254679.0,long,2020-11-06
578,106628809.0,11/06/2020 11:26:51 EST,TME,Tencent Music,15.38,200,3076.00,STOCK,,,BUY,,950091606.0,long,2020-11-06
579,106613363.0,11/06/2020 11:14:55 EST,UBER,Uber,0.40,1,40.00,OPTION,42.50,put,SELL,2020-11-13,950121423.0,long,2020-11-06
580,106612010.0,11/06/2020 11:14:12 EST,NIO,NIO Inc.,1.81,1,181.00,OPTION,40.00,put,SELL,2020-11-13,950076017.0,long,2020-11-06
581,106609603.0,11/06/2020 11:12:55 EST,SQQQ,ProShares UltraPro Short QQQ,19.10,200,3820.00,STOCK,,,SELL,,913244796.0,short,2020-11-06
582,106605892.0,11/06/2020 11:10:41 EST,HYLN,Hyliion Holdings Corporation,22.72,100,2272.00,STOCK,,,BUY,,950122538.0,long,2020-11-06
583,106576286.0,11/06/2020 11:05:42 EST,UBER,Uber,45.00,200,9000.00,STOCK,,,SELL,,950121423.0,short,2020-11-06
584,106567923.0,11/06/2020 10:49:53 EST,MRNA,Moderna,3.00,1,300.00,OPTION,70.00,call,BUY,2020-11-06,950102542.0,long,2020-11-06
585,106564091.0,11/06/2020 10:47:38 EST,UBER,Uber,0.77,1,77.00,OPTION,44.00,call,BUY,2020-11-06,950121423.0,long,2020-11-06
586,106466372.0,11/06/2020 09:57:37 EST,SQQQ,ProShares UltraPro Short QQQ,0.18,2,36.00,OPTION,20.00,call,BUY,2020-11-06,913244796.0,long,2020-11-06
587,106462509.0,11/06/2020 09:56:17 EST,UBER,Uber,0.23,1,23.00,OPTION,44.00,call,SELL,2020-11-06,950121423.0,short,2020-11-06
588,106187151.0,11/05/2020 16:40:37 EST,UBER,Uber,43.00,100,4300.00,STOCK,,,SELL,,950121423.0,short,2020-11-05
589,106109579.0,11/05/2020 14:17:31 EST,JWN,Nordstrom,0.33,2,66.00,OPTION,12.00,put,SELL,2020-11-13,913255449.0,long,2020-11-05
590,106083141.0,11/05/2020 13:46:32 EST,NIO,NIO Inc.,40.18,100,4018.00,STOCK,,,SELL,,950076017.0,short,2020-11-05
591,106078267.0,11/05/2020 13:40:16 EST,NIO,NIO Inc.,7.00,1,700.00,OPTION,33.00,call,BUY,2020-11-06,950076017.0,long,2020-11-05
592,105969124.0,11/05/2020 11:33:20 EST,HYLN,Hyliion Holdings Corporation,0.65,1,65.00,OPTION,22.00,put,SELL,2020-11-06,950122538.0,long,2020-11-05
593,105954560.0,11/05/2020 12:20:11 EST,JMIA,Jumia,19.61,100,1961.00,STOCK,,,BUY,,950117409.0,long,2020-11-05
594,105951202.0,11/05/2020 11:13:26 EST,JMIA,Jumia,18.86,100,1886.00,STOCK,,,SHORT,,950117409.0,short,2020-11-05
595,105937604.0,11/05/2020 11:00:40 EST,SQQQ,ProShares UltraPro Short QQQ,18.88,100,1888.00,STOCK,,,SELL,,913244796.0,short,2020-11-05
596,105836068.0,11/05/2020 10:02:12 EST,SQQQ,ProShares UltraPro Short QQQ,0.20,2,40.00,OPTION,20.00,call,SELL,2020-11-06,913244796.0,short,2020-11-05
597,105813156.0,11/05/2020 09:53:13 EST,SQQQ,ProShares UltraPro Short QQQ,18.83,100,1882.50,STOCK,,,BUY,,913244796.0,long,2020-11-05
598,105573136.0,11/04/2020 15:22:14 EST,HYLN,Hyliion Holdings Corporation,20.87,100,2087.00,STOCK,,,SELL,,950122538.0,short,2020-11-04
599,105572924.0,11/04/2020 15:21:53 EST,HYLN,Hyliion Holdings Corporation,20.85,100,2085.00,STOCK,,,SELL,,950122538.0,short,2020-11-04
600,105394114.0,11/04/2020 11:10:20 EST,SQQQ,ProShares UltraPro Short QQQ,20.67,100,2066.87,STOCK,,,BUY,,913244796.0,long,2020-11-04
601,105390076.0,11/04/2020 11:06:30 EST,PHM,PulteGroup,45.54,100,4553.62,STOCK,,,SELL,,913324137.0,short,2020-11-04
602,105373449.0,11/04/2020 10:51:16 EST,UBER,Uber,3.40,1,340.00,OPTION,38.00,call,BUY,2020-11-06,950121423.0,long,2020-11-04
603,105340294.0,11/04/2020 10:25:52 EST,PHM,PulteGroup,4.00,1,400.00,OPTION,42.50,call,BUY,2020-11-06,913324137.0,long,2020-11-04
604,105313394.0,11/04/2020 10:08:29 EST,UBER,Uber,4.65,1,465.00,OPTION,36.00,call,BUY,2020-11-06,950121423.0,long,2020-11-04
605,105212597.0,11/04/2020 09:15:39 EST,SQQQ,ProShares UltraPro Short QQQ,21.22,100,2122.00,STOCK,,,BUY,,913244796.0,long,2020-11-04
606,105057386.0,11/03/2020 14:58:44 EST,UBER,Uber,2.14,1,214.00,OPTION,36.00,call,BUY,2020-11-06,950121423.0,long,2020-11-03
607,105007873.0,11/03/2020 13:28:04 EST,RKT,Rocket Companies,19.27,100,1927.00,STOCK,,,SELL,,950168855.0,short,2020-11-03
608,105003734.0,11/03/2020 13:21:10 EST,HYLN,Hyliion Holdings Corporation,2.00,1,200.00,OPTION,20.00,put,SELL,2020-11-13,950122538.0,long,2020-11-03
609,104887198.0,11/03/2020 10:49:02 EST,NIO,NIO Inc.,2.15,1,215.00,OPTION,33.00,call,SELL,2020-11-06,950076017.0,short,2020-11-03
610,104886983.0,11/03/2020 10:48:50 EST,NIO,NIO Inc.,1.21,5,605.00,OPTION,35.00,call,SELL,2020-11-06,950076017.0,short,2020-11-03
611,104881173.0,11/03/2020 10:43:54 EST,NIO,NIO Inc.,1.57,6,942.00,OPTION,34.00,call,BUY,2020-11-06,950076017.0,long,2020-11-03
612,104831977.0,11/03/2020 10:09:03 EST,RKT,Rocket Companies,19.77,100,1977.00,STOCK,,,BUY,,950168855.0,long,2020-11-03
613,104730098.0,11/03/2020 08:57:16 EST,BABA,Alibaba,287.90,5,1439.50,STOCK,,,BUY,,913254558.0,long,2020-11-03
614,104597874.0,11/02/2020 14:55:49 EST,PHM,PulteGroup,0.80,1,80.00,OPTION,42.50,call,SELL,2020-11-06,913324137.0,short,2020-11-02
615,104507714.0,11/02/2020 12:22:45 EST,LAKE,Lakeland Ind,22.67,100,2267.00,STOCK,,,BUY,,913323383.0,long,2020-11-02
616,104475918.0,11/02/2020 11:39:57 EST,TSLA,TESLA,394.89,10,3948.87,STOCK,,,SELL,,913255598.0,short,2020-11-02
617,104456584.0,11/02/2020 11:18:43 EST,UBER,Uber,0.82,1,82.00,OPTION,38.00,call,SELL,2020-11-06,950121423.0,short,2020-11-02
618,104456354.0,11/02/2020 11:18:30 EST,UBER,Uber,1.52,2,304.00,OPTION,36.00,call,SELL,2020-11-06,950121423.0,short,2020-11-02
619,104451644.0,11/02/2020 11:39:26 EST,DIS,Walt Disney,3.15,4,1260.00,OPTION,135.00,call,SELL,2021-01-15,913255192.0,short,2020-11-02
620,104413761.0,11/02/2020 10:38:52 EST,NIO,NIO Inc.,1.31,1,131.00,OPTION,34.00,call,SELL,2020-11-06,950076017.0,short,2020-11-02
621,104413274.0,11/02/2020 10:36:15 EST,NIO,NIO Inc.,0.80,1,80.00,OPTION,36.00,call,BUY,2020-11-06,950076017.0,long,2020-11-02
622,104396664.0,11/02/2020 10:22:33 EST,BYND,Beyond Meat,145.24,10,1452.42,STOCK,,,SELL,,950104120.0,short,2020-11-02
623,104367490.0,11/02/2020 10:04:06 EST,MRNA,Moderna,1.50,1,150.00,OPTION,70.00,call,SELL,2020-11-06,950102542.0,short,2020-11-02
624,104329143.0,11/02/2020 09:45:20 EST,NIO,NIO Inc.,1.83,1,183.00,OPTION,36.00,call,SELL,2020-11-06,950076017.0,short,2020-11-02
625,104313286.0,11/02/2020 09:39:20 EST,NIO,NIO Inc.,0.68,1,68.00,OPTION,30.00,put,SELL,2020-11-06,950076017.0,long,2020-11-02
626,104304281.0,11/02/2020 09:35:59 EST,INTC,Intel,0.47,1,47.00,OPTION,45.50,call,SELL,2020-11-06,913257268.0,short,2020-11-02
627,104299934.0,11/02/2020 09:34:50 EST,NIO,NIO Inc.,1.82,5,912.00,OPTION,34.00,call,SELL,2020-11-06,950076017.0,short,2020-11-02
628,104106856.0,10/30/2020 14:35:05 EDT,UBER,Uber,0.12,3,36.00,OPTION,33.50,call,BUY,2020-10-30,950121423.0,long,2020-10-30
629,104106531.0,10/30/2020 14:34:33 EDT,TDOC,TELADOC HEALTH,195.32,5,976.60,STOCK,,,BUY,,913254759.0,long,2020-10-30
630,104000310.0,10/30/2020 12:02:01 EDT,INTC,Intel,0.05,1,5.00,OPTION,44.50,call,SELL,2020-10-30,913257268.0,short,2020-10-30
631,103999947.0,10/30/2020 12:01:39 EDT,INTC,Intel,44.06,50,2203.00,STOCK,,,BUY,,913257268.0,long,2020-10-30
632,103915356.0,10/30/2020 10:48:10 EDT,UBER,Uber,0.25,3,75.00,OPTION,33.50,call,SELL,2020-10-30,950121423.0,short,2020-10-30
633,103913919.0,10/30/2020 10:47:25 EDT,BYND,Beyond Meat,144.74,10,1447.40,STOCK,,,BUY,,950104120.0,long,2020-10-30
634,103911850.0,10/30/2020 10:46:09 EDT,TSLA,TESLA,385.09,5,1925.45,STOCK,,,BUY,,913255598.0,long,2020-10-30
635,103910613.0,10/30/2020 10:45:25 EDT,NIO,NIO Inc.,0.26,6,156.00,OPTION,31.00,call,SELL,2020-10-30,950076017.0,short,2020-10-30
636,103910127.0,10/30/2020 10:45:08 EDT,NIO,NIO Inc.,30.50,100,3050.16,STOCK,,,SELL,,950076017.0,short,2020-10-30
637,103909787.0,10/30/2020 10:44:57 EDT,NIO,NIO Inc.,0.10,7,70.00,OPTION,32.00,call,BUY,2020-10-30,950076017.0,long,2020-10-30
638,103892852.0,10/30/2020 10:35:32 EDT,TSLA,TESLA,387.22,5,1936.10,STOCK,,,BUY,,913255598.0,long,2020-10-30
639,103827336.0,10/30/2020 09:58:57 EDT,TDOC,TELADOC HEALTH,206.71,5,1033.55,STOCK,,,BUY,,913254759.0,long,2020-10-30
640,103756797.0,10/30/2020 09:31:50 EDT,V,Visa,182.73,20,3654.60,STOCK,,,SELL,,913324504.0,short,2020-10-30
641,103529352.0,10/29/2020 14:06:52 EDT,NIO,NIO Inc.,0.48,7,336.00,OPTION,32.00,call,SELL,2020-10-30,950076017.0,short,2020-10-29
642,103462750.0,10/29/2020 12:30:39 EDT,NIO,NIO Inc.,0.53,1,53.00,OPTION,30.00,put,SELL,2020-10-30,950076017.0,long,2020-10-29
643,103456323.0,10/29/2020 12:22:10 EDT,NIO,NIO Inc.,0.99,7,693.00,OPTION,30.00,call,BUY,2020-10-30,950076017.0,long,2020-10-29
644,103449951.0,10/29/2020 12:13:52 EDT,INTC,Intel,44.10,50,2205.00,STOCK,,,BUY,,913257268.0,long,2020-10-29
645,103409212.0,10/29/2020 11:25:56 EDT,DKNG,DraftKings Inc,38.13,100,3812.53,STOCK,,,SELL,,950153166.0,short,2020-10-29
646,103387258.0,10/29/2020 11:04:11 EDT,HYLN,Hyliion Holdings Corporation,1.50,1,150.00,OPTION,20.00,put,SELL,2020-11-06,950122538.0,long,2020-10-29
647,103367173.0,10/29/2020 10:46:33 EDT,CCL,Carnival,12.92,100,1292.17,STOCK,,,SELL,,913255078.0,short,2020-10-29
648,103358262.0,10/29/2020 10:39:20 EDT,HYLN,Hyliion Holdings Corporation,20.17,200,4034.00,STOCK,,,SELL,,950122538.0,short,2020-10-29
649,103356901.0,10/29/2020 10:38:12 EDT,BYND,Beyond Meat,152.52,10,1525.18,STOCK,,,SELL,,950104120.0,short,2020-10-29
650,103327818.0,10/29/2020 10:17:57 EDT,NIO,NIO Inc.,0.63,7,441.00,OPTION,30.00,call,SELL,2020-10-30,950076017.0,short,2020-10-29
651,103302292.0,10/29/2020 10:03:29 EDT,NIO,NIO Inc.,2.10,7,1470.00,OPTION,28.00,call,BUY,2020-10-30,950076017.0,long,2020-10-29
652,103299110.0,10/29/2020 10:02:19 EDT,FSLY,Fastly,68.53,20,1370.60,STOCK,,,SELL,,950122211.0,short,2020-10-29
653,103244217.0,10/29/2020 09:37:46 EDT,UBER,Uber,1.06,2,212.00,OPTION,33.00,call,BUY,2020-10-30,950121423.0,long,2020-10-29
654,103221591.0,10/29/2020 09:30:37 EDT,FSLY,Fastly,74.32,50,3715.79,STOCK,,,SELL,,950122211.0,short,2020-10-29
655,102935691.0,10/28/2020 12:13:44 EDT,BYND,Beyond Meat,158.03,10,1580.30,STOCK,,,BUY,,950104120.0,long,2020-10-28
656,102933800.0,10/28/2020 12:12:00 EDT,UBER,Uber,0.90,1,90.00,OPTION,33.00,call,BUY,2020-10-30,950121423.0,long,2020-10-28
657,102854937.0,10/28/2020 10:52:33 EDT,UBER,Uber,0.60,3,180.00,OPTION,33.00,call,SELL,2020-10-30,950121423.0,short,2020-10-28
658,102854629.0,10/28/2020 10:52:19 EDT,UBER,Uber,0.04,3,12.00,OPTION,36.00,call,BUY,2020-10-30,950121423.0,long,2020-10-28
659,102774908.0,10/28/2020 10:03:19 EDT,DKNG,DraftKings Inc,1.40,1,140.00,OPTION,39.00,call,BUY,2020-10-30,950153166.0,long,2020-10-28
660,102501732.0,10/27/2020 15:34:01 EDT,HYLN,Hyliion Holdings Corporation,0.50,2,100.00,OPTION,22.00,call,BUY,2020-10-30,950122538.0,long,2020-10-27
661,102494003.0,10/27/2020 15:23:45 EDT,NIO,NIO Inc.,0.86,1,86.00,OPTION,28.00,call,SELL,2020-10-30,950076017.0,short,2020-10-27
662,102493855.0,10/27/2020 15:23:34 EDT,NIO,NIO Inc.,2.28,1,228.00,OPTION,26.00,call,BUY,2020-10-30,950076017.0,long,2020-10-27
663,102479609.0,10/27/2020 15:01:53 EDT,CCL,Carnival,13.81,100,1380.83,STOCK,,,BUY,,913255078.0,long,2020-10-27
664,102470684.0,10/27/2020 14:47:39 EDT,SLV,iShares Silver Trust,22.71,200,4542.00,STOCK,,,SELL,,913244503.0,short,2020-10-27
665,102470446.0,10/27/2020 14:47:17 EDT,RKT,Rocket Companies,20.28,100,2028.00,STOCK,,,SELL,,950168855.0,short,2020-10-27
666,102469572.0,10/27/2020 14:46:04 EDT,V,Visa,189.29,5,946.44,STOCK,,,BUY,,913324504.0,long,2020-10-27
667,102428037.0,10/27/2020 13:37:42 EDT,DKNG,DraftKings Inc,1.11,1,111.00,OPTION,39.00,call,SELL,2020-10-30,950153166.0,short,2020-10-27
668,102427956.0,10/27/2020 13:37:33 EDT,DKNG,DraftKings Inc,0.49,1,49.00,OPTION,41.00,call,BUY,2020-10-30,950153166.0,long,2020-10-27
669,102416569.0,10/27/2020 13:20:54 EDT,HYLN,Hyliion Holdings Corporation,0.32,2,64.00,OPTION,22.00,call,SELL,2020-10-30,950122538.0,short,2020-10-27
670,102222661.0,10/27/2020 10:05:21 EDT,PHM,PulteGroup,0.30,1,30.00,OPTION,43.50,call,SELL,2020-10-30,913324137.0,short,2020-10-27
671,102201743.0,10/27/2020 09:52:18 EDT,PHM,PulteGroup,42.13,20,842.60,STOCK,,,BUY,,913324137.0,long,2020-10-27
672,102182656.0,10/27/2020 09:43:55 EDT,UBER,Uber,0.31,3,93.00,OPTION,36.00,call,SELL,2020-10-30,950121423.0,short,2020-10-27
673,102181187.0,10/27/2020 09:43:18 EDT,RKT,Rocket Companies,19.84,100,1983.65,STOCK,,,BUY,,950168855.0,long,2020-10-27
674,101956948.0,10/26/2020 14:24:17 EDT,UBER,Uber,0.08,3,24.00,OPTION,38.00,call,BUY,2020-10-30,950121423.0,long,2020-10-26
675,101916179.0,10/26/2020 13:31:22 EDT,NIO,NIO Inc.,0.75,1,75.00,OPTION,26.00,call,SELL,2020-10-30,950076017.0,short,2020-10-26
676,101916078.0,10/26/2020 13:31:16 EDT,NIO,NIO Inc.,25.53,100,2552.84,STOCK,,,BUY,,950076017.0,long,2020-10-26
677,101868115.0,10/26/2020 12:34:54 EDT,PHM,PulteGroup,42.59,10,425.95,STOCK,,,BUY,,913324137.0,long,2020-10-26
678,101830968.0,10/26/2020 11:47:14 EDT,PHM,PulteGroup,43.05,50,2152.50,STOCK,,,BUY,,913324137.0,long,2020-10-26
679,101825146.0,10/26/2020 11:41:06 EDT,V,Visa,192.60,5,963.00,STOCK,,,BUY,,913324504.0,long,2020-10-26
680,101819423.0,10/26/2020 11:35:30 EDT,TDOC,TELADOC HEALTH,213.17,5,1065.85,STOCK,,,BUY,,913254759.0,long,2020-10-26
681,101813860.0,10/26/2020 11:30:26 EDT,UBER,Uber,0.18,2,36.00,OPTION,37.50,call,SELL,2020-10-30,950121423.0,short,2020-10-26
682,101780742.0,10/26/2020 11:05:25 EDT,PHM,PulteGroup,42.82,20,856.40,STOCK,,,BUY,,913324137.0,long,2020-10-26
683,101779544.0,10/26/2020 11:03:37 EDT,FSLY,Fastly,73.72,10,737.18,STOCK,,,BUY,,950122211.0,long,2020-10-26
684,101778481.0,10/26/2020 11:02:58 EDT,DKNG,DraftKings Inc,1.21,1,121.00,OPTION,41.00,call,SELL,2020-10-30,950153166.0,short,2020-10-26
685,101775657.0,10/26/2020 11:01:11 EDT,NIO,NIO Inc.,0.35,6,210.00,OPTION,28.00,call,SELL,2020-10-30,950076017.0,short,2020-10-26
686,101771806.0,10/26/2020 10:58:35 EDT,NIO,NIO Inc.,0.57,2,114.00,OPTION,26.00,put,SELL,2020-10-30,950076017.0,long,2020-10-26
687,101771221.0,10/26/2020 10:58:11 EDT,HYLN,Hyliion Holdings Corporation,0.91,1,91.00,OPTION,20.00,put,SELL,2020-10-30,950122538.0,long,2020-10-26
688,101673218.0,10/26/2020 09:55:38 EDT,DKNG,DraftKings Inc,42.11,50,2105.72,STOCK,,,BUY,,950153166.0,long,2020-10-26
689,101649381.0,10/26/2020 09:45:16 EDT,V,Visa,194.84,10,1948.40,STOCK,,,BUY,,913324504.0,long,2020-10-26
690,101644348.0,10/26/2020 09:51:56 EDT,GS,Goldman Sachs,5.00,3,1500.00,OPTION,240.00,call,SELL,2021-04-16,913255353.0,short,2020-10-26
691,101386479.0,10/23/2020 14:27:24 EDT,NIO,NIO Inc.,0.15,6,90.00,OPTION,27.00,call,BUY,2020-10-23,950076017.0,long,2020-10-23
692,101279578.0,10/23/2020 12:00:49 EDT,DKNG,DraftKings Inc,42.15,50,2107.50,STOCK,,,BUY,,950153166.0,long,2020-10-23
693,101205073.0,10/23/2020 10:52:58 EDT,UBER,Uber,0.35,3,105.00,OPTION,38.00,call,SELL,2020-10-30,950121423.0,short,2020-10-23
694,101204691.0,10/23/2020 10:52:42 EDT,UBER,Uber,0.51,2,102.00,OPTION,37.50,call,BUY,2020-10-30,950121423.0,long,2020-10-23
695,101168493.0,10/23/2020 10:26:28 EDT,UBER,Uber,0.31,3,93.00,OPTION,36.50,call,BUY,2020-10-23,950121423.0,long,2020-10-23
696,101158641.0,10/23/2020 10:20:18 EDT,NIO,NIO Inc.,0.17,5,85.00,OPTION,27.00,call,SELL,2020-10-23,950076017.0,short,2020-10-23
697,101151719.0,10/23/2020 10:16:29 EDT,MGM,MGM Resorts Intl,0.05,2,10.00,OPTION,23.00,call,SELL,2020-10-23,913323750.0,short,2020-10-23
698,101143799.0,10/23/2020 10:12:19 EDT,NIO,NIO Inc.,1.04,5,520.00,OPTION,27.00,call,BUY,2020-10-30,950076017.0,long,2020-10-23
699,101141580.0,10/23/2020 10:11:06 EDT,MGM,MGM Resorts Intl,0.31,2,62.00,OPTION,22.50,call,BUY,2020-10-23,913323750.0,long,2020-10-23
700,101131866.0,10/23/2020 10:06:08 EDT,NIO,NIO Inc.,0.13,1,13.00,OPTION,27.00,call,SELL,2020-10-23,950076017.0,short,2020-10-23
701,101127730.0,10/23/2020 10:05:12 EDT,NIO,NIO Inc.,26.50,100,2650.00,STOCK,,,BUY,,950076017.0,long,2020-10-23
702,101118818.0,10/23/2020 09:59:54 EDT,FSLY,Fastly,74.92,50,3745.75,STOCK,,,BUY,,950122211.0,long,2020-10-23
703,101105032.0,10/23/2020 09:53:49 EDT,FSLY,Fastly,74.11,10,741.10,STOCK,,,BUY,,950122211.0,long,2020-10-23
704,101094910.0,10/23/2020 09:49:33 EDT,NIO,NIO Inc.,1.03,5,515.00,OPTION,27.00,call,SELL,2020-10-30,950076017.0,short,2020-10-23
705,101087841.0,10/23/2020 09:46:45 EDT,NIO,NIO Inc.,0.04,5,20.00,OPTION,28.00,call,BUY,2020-10-23,950076017.0,long,2020-10-23
706,101079967.0,10/23/2020 09:43:33 EDT,WKHS,Workhorse Group,19.74,200,3947.28,STOCK,,,SELL,,913253615.0,short,2020-10-23
707,101072648.0,10/23/2020 09:54:44 EDT,TDOC,TELADOC HEALTH,213.58,5,1067.90,STOCK,,,BUY,,913254759.0,long,2020-10-23
708,101048785.0,10/23/2020 09:33:44 EDT,UBER,Uber,0.13,3,39.00,OPTION,36.50,call,SELL,2020-10-23,950121423.0,short,2020-10-23
709,100848367.0,10/22/2020 15:23:38 EDT,HYLN,Hyliion Holdings Corporation,1.10,1,110.00,OPTION,22.00,put,SELL,2020-10-30,950122538.0,long,2020-10-22
710,100826421.0,10/22/2020 14:50:24 EDT,HYLN,Hyliion Holdings Corporation,0.55,1,55.00,OPTION,26.00,call,SELL,2020-10-23,950122538.0,short,2020-10-22
711,100824160.0,10/22/2020 14:46:56 EDT,HYLN,Hyliion Holdings Corporation,1.13,1,113.00,OPTION,25.00,call,BUY,2020-10-23,950122538.0,long,2020-10-22
712,100818509.0,10/22/2020 14:38:04 EDT,UBER,Uber,0.49,1,49.00,OPTION,36.00,call,BUY,2020-10-23,950121423.0,long,2020-10-22
713,100760234.0,10/22/2020 13:13:27 EDT,UBER,Uber,0.30,1,30.00,OPTION,36.00,call,BUY,2020-10-23,950121423.0,long,2020-10-22
714,100720600.0,10/22/2020 12:19:52 EDT,MGM,MGM Resorts Intl,0.18,1,18.00,OPTION,22.50,call,SELL,2020-10-23,913323750.0,short,2020-10-22
715,100655965.0,10/22/2020 11:48:11 EDT,TDOC,TELADOC HEALTH,215.30,5,1076.50,STOCK,,,BUY,,913254759.0,long,2020-10-22
716,100644576.0,10/22/2020 11:02:59 EDT,GS,Goldman Sachs,5.90,1,590.00,OPTION,240.00,call,BUY,2021-04-16,913255353.0,long,2020-10-22
717,100636612.0,10/22/2020 10:56:43 EDT,MGM,MGM Resorts Intl,0.80,1,80.00,OPTION,21.50,call,BUY,2020-10-23,913323750.0,long,2020-10-22
718,100529715.0,10/22/2020 09:55:26 EDT,MGM,MGM Resorts Intl,0.20,1,20.00,OPTION,22.50,call,SELL,2020-10-23,913323750.0,short,2020-10-22
719,100176534.0,10/21/2020 13:07:03 EDT,UBER,Uber,35.13,50,1756.50,STOCK,,,BUY,,950121423.0,long,2020-10-21
720,99991543.0,10/21/2020 10:28:22 EDT,UBER,Uber,0.41,1,41.00,OPTION,36.00,call,SELL,2020-10-23,950121423.0,short,2020-10-21
721,99976311.0,10/21/2020 10:18:34 EDT,PTON,Peloton Interactive Inc,133.02,10,1330.20,STOCK,,,BUY,,950138392.0,long,2020-10-21
722,99970289.0,10/21/2020 10:15:02 EDT,WKHS,Workhorse Group,20.10,100,2010.00,STOCK,,,BUY,,913253615.0,long,2020-10-21
723,99952044.0,10/21/2020 10:05:12 EDT,UBER,Uber,0.32,1,32.00,OPTION,36.00,call,SELL,2020-10-23,950121423.0,short,2020-10-21
724,99893008.0,10/21/2020 09:41:02 EDT,UBER,Uber,35.64,50,1781.91,STOCK,,,BUY,,950121423.0,long,2020-10-21
725,99636116.0,10/20/2020 15:13:23 EDT,U,Unity Software Inc.,87.33,30,2619.90,STOCK,,,SELL,,950172451.0,short,2020-10-20
726,99597423.0,10/20/2020 14:11:22 EDT,UBER,Uber,1.00,2,200.00,OPTION,36.00,call,BUY,2020-10-23,950121423.0,long,2020-10-20
727,99540896.0,10/20/2020 12:54:11 EDT,U,Unity Software Inc.,88.99,10,889.90,STOCK,,,BUY,,950172451.0,long,2020-10-20
728,99439867.0,10/20/2020 11:11:03 EDT,GILD,Gilead Sciences,59.98,150,8997.17,STOCK,,,SELL,,913256732.0,short,2020-10-20
729,99439560.0,10/20/2020 11:10:50 EDT,GILD,Gilead Sciences,0.09,1,9.00,OPTION,62.00,call,BUY,2020-10-23,913256732.0,long,2020-10-20
730,99422756.0,10/20/2020 10:59:50 EDT,WKHS,Workhorse Group,20.77,100,2077.00,STOCK,,,BUY,,913253615.0,long,2020-10-20
731,99408955.0,10/20/2020 10:48:16 EDT,TDOC,TELADOC HEALTH,222.78,10,2227.76,STOCK,,,BUY,,913254759.0,long,2020-10-20
732,99393732.0,10/20/2020 10:37:37 EDT,NIO,NIO Inc.,0.57,2,114.00,OPTION,25.00,put,SELL,2020-10-30,950076017.0,long,2020-10-20
733,99343984.0,10/20/2020 10:12:55 EDT,UBER,Uber,0.49,2,98.00,OPTION,36.00,call,SELL,2020-10-23,950121423.0,short,2020-10-20
734,99340109.0,10/20/2020 10:06:34 EDT,MGM,MGM Resorts Intl,0.31,1,31.00,OPTION,21.50,call,SELL,2020-10-23,913323750.0,short,2020-10-20
735,99317927.0,10/20/2020 09:57:05 EDT,UBER,Uber,1.08,5,540.00,OPTION,40.00,call,SELL,2020-11-20,950121423.0,short,2020-10-20
736,98962643.0,10/19/2020 13:28:49 EDT,U,Unity Software Inc.,89.82,10,898.20,STOCK,,,BUY,,950172451.0,long,2020-10-19
737,98962348.0,10/19/2020 13:27:03 EDT,NIO,NIO Inc.,0.04,2,8.00,OPTION,21.50,put,BUY,2020-10-23,950076017.0,short,2020-10-19
738,98962056.0,10/19/2020 13:28:00 EDT,MRNA,Moderna,3.80,1,380.00,OPTION,71.00,put,SELL,2020-10-30,950102542.0,long,2020-10-19
739,98816460.0,10/19/2020 11:00:39 EDT,GS,Goldman Sachs,6.90,2,1380.00,OPTION,240.00,call,BUY,2021-04-16,913255353.0,long,2020-10-19
740,98793550.0,10/19/2020 10:44:28 EDT,PTON,Peloton Interactive Inc,127.82,10,1278.20,STOCK,,,SHORT,,950138392.0,short,2020-10-19
741,98781009.0,10/19/2020 10:36:39 EDT,HYLN,Hyliion Holdings Corporation,1.15,1,115.00,OPTION,25.00,call,SELL,2020-10-23,950122538.0,short,2020-10-19
742,98771586.0,10/19/2020 10:30:55 EDT,GILD,Gilead Sciences,0.35,1,35.00,OPTION,62.00,call,SELL,2020-10-23,913256732.0,short,2020-10-19
743,98764297.0,10/19/2020 10:26:45 EDT,GILD,Gilead Sciences,61.13,50,3056.50,STOCK,,,BUY,,913256732.0,long,2020-10-19
744,98681353.0,10/19/2020 09:48:58 EDT,UBER,Uber,0.78,5,390.00,OPTION,40.00,call,BUY,2020-11-20,950121423.0,long,2020-10-19
745,98673991.0,10/19/2020 09:46:13 EDT,UBER,Uber,0.61,2,122.00,OPTION,34.50,call,BUY,2020-10-23,950121423.0,long,2020-10-19
746,98463933.0,10/16/2020 15:58:11 EDT,UBER,Uber,0.39,2,78.00,OPTION,34.50,call,SELL,2020-10-23,950121423.0,short,2020-10-16
747,98463547.0,10/16/2020 15:57:51 EDT,UBER,Uber,0.01,1,1.00,OPTION,35.00,call,BUY,2020-10-16,950121423.0,long,2020-10-16
748,98463126.0,10/16/2020 15:58:25 EDT,GILD,Gilead Sciences,61.98,50,3099.00,STOCK,,,BUY,,913256732.0,long,2020-10-16
749,98406817.0,10/16/2020 14:47:22 EDT,NIO,NIO Inc.,1.99,5,995.00,OPTION,28.00,call,SELL,2020-10-23,950076017.0,short,2020-10-16
750,98406680.0,10/16/2020 14:47:07 EDT,NIO,NIO Inc.,0.06,5,29.00,OPTION,29.00,call,BUY,2020-10-16,950076017.0,long,2020-10-16
751,98296222.0,10/16/2020 12:24:55 EDT,GILD,Gilead Sciences,62.26,50,3113.00,STOCK,,,BUY,,913256732.0,long,2020-10-16
